1	lu keren koh panutan generasi muda mimpi nge direct film goodluck film imperfect	1
1	film menceritakan body shaming	2
1	film ceritanya cewek gendut kurus	2
1	wow mas reza rahadian	2
1	kasih lakilaki dika please	2
1	so sweet banget si dika rara	2
1	benar keadilan sosial rakyak good looking	2
1	duh andai pacar kayak dika	2
1	semangat rara	2
1	rara deh dicintai cowoknya	2
2	sheila dara film nkcthi mantannya vidi aldiano sih	2
2	kale ganteng banget keren deh ardhito pramono	2
2	kehidupan tokoh nkcthi keluarga berkecukupan semuauntuk menggambarkan anak karyawan bank kurasa keluarga tajir banget agak abmormal sih memaklumi scene ditunjukan rumah tempati warisan keluarga ajeng istrinya	2
2	awan dihubungi harusnya angkasa kale awan cerita kale sumber konflik	2
2	eh rio dewanto film nkcthi my idola	2
2	mikir kejauhan kale saudara kembar awan diadopsi ahhaa ngira kayak gini	2
2	menyepelekan ditanggapi wajar sang wajah si anak meninggal si baru siuman	2
2	maaf agak spoiler akhir film diceritakan sumber segala konflik rumah adiknya awan sepengetahuan ibunya eh meninggal lahir seheboh	2
2	hehehe rio dewanto ganteng banget	2
2	awan cantik banget	2
3	semoga sequel bagus ceritanya semoga berat berat lanjutkan bumi langit	2
3	cepat bangga pencapaian film gundala mengoreksi kekurangan banyak komentar sukses	2
3	abina film gundala berwibawa	2
3	gundala menampilkan sancaka bocah	2
4	nonton film garis biru posesif gendre filmku sungguh mudah ditebak	2
4	baru nonton film garis birumenurut gua jauh realita film cowo tanggung rela ngurusin anak sendirisedangkan cewe pergi negeri wujudin impian	2
4	gabut nonton film garis biru baru sadar bodoh banget tu cowok dalem rumit	2
4	tolong kaji penayangan film garis biru	2
4	zahraaaaa lucu banget film garis biru	2
4	maknamakna tersendiri naskah ditulis gina noer membiarkan penonton larut alunan ceritanya filmdua garis biru gina snoer penulis naskah	2
5	wuaaa bikin nostalgia pas kampoeng kidzzz ketemu kakak selamat pagi indonesiaaa	2
5	adegan sayidah nonjok clay real banget no kaleng	2
5	ajil dito gua	2
10	cowo protektif tuh kayak bodyguard ugalugalan aza dipinggirin cowo posesif tuh kayak satpam kompleks disamperin macem id card segala	2
10	mendingan gue nonton bodyguard ugalugalan temen gue	2
10	iya ugal ugalan bodyguard syahrini	2
10	setalah gugel judulnya bodyguard ugal ugalan mba	2
10	berpikir lagu syahrini ost bodyguard ugalugalan gubrak gubrak jeng jeng runaway babynya bruno mars	2
10	gada ngeladenin nonton bodyguard ugalugalan	2
10	salfokk si nicole deh	2
10	tamara tua cakep ajeee	2
10	sukakkk boris disiniii kwkw	2
10	loloxx idola aingggg	2
11	nontonnya film rafathar nobar anakku frozen	2
11	film rafathar	2
11	fix film rafathar	2
11	dibanding film rafathar	2
11	film rafathar mind blowing banget loh	2
11	kemana move on film rafathar	2
11	rafathar wkakaka berpikiran nonton film	2
11	tau film rafathar	2
11	rafathar kayak niru film baby days out	2
11	halah boong bilang lu nunggu film rafathar	2
11	ra pictures garap film rafathar si	2
11	rafathar mini main film	2
11	mnctv nayangin film rafathar	2
11	tuhan baru nonton sinetron azab indosiar humornya ngelebihin film rafathar raffi ahmad hahahahaha	2
11	coming soon oktalogi film rafathar	2
11	biar film sekelas rafathar cuman film rafathar doang dibully	2
11	rafathar larinya bikin emess	2
11	baby day out versi indonesia haha	2
11	gemesh banget yaallah rafatar	2
11	rafatar lucu banget semoga rafatar pintar rafatar lucu gemes	2
12	nanya kuntilanak md	2
12	ngajak film kuntilanak	2
12	pas tweet kirain poster film kuntilanak	2
12	kebanyakan nonton film kuntilanak ah masnya wkwk	2
12	mood jelek diving mending nonton film kuntilanak	2
12	ehhhh film pocong vs kuntilanak	2
12	tau setan kuntilanak pakeannya putih film	2
13	nonton film hanum rangga merinding live tv	2
13	film diadaptasi novel hanum rangga	2
13	tidur gara kepikiran meranin tokoh rangga film hanum rangga	2
13	hanum rais promosi film hanum rangga	2
13	sesungguhnya film hanum rangga cerminan pasangan suami istri impian gmna	2
13	anjay hanum rangga trans film korban politik wkwk	2
13	poster sekuwel film hanum rangga	2
13	film hanum rangga ape mak	2
13	film hanum rangga kemarin promo buy get sih min kayaknya deh eh gimana	2
1	official poster film imperfect karier cinta timbangan kenalin rara dika rara suka insecure fisiknya dika bilang sayang rara penasaran cerita imperfect karier cinta timbangan tayang bioskop tanggal desember	2
1	totalitas batas perannya film imperfect jessica mila menaikan berat badan kg	2
1	totalitas batas perannya film imperfect jessica mila menaikan berat badan kg	2
1	sabar film imperfect biokop	2
1	penampilan jessica mila film imperfect nyaris dikenali saking bedanya simak video selengkapnya	2
1	koh target penonton film imperfect	2
1	ernest prakasa bantah video reza rahadian mencium kiky saputri gimmick film imperfect penjelasan ernest	2
1	ernest prakasa bantah video reza rahadian mencium kiky saputri gimmick film imperfect penjelasan ernest	2
1	nonton film imperfect pacarnya rara namanya dika anjas dika inget crush pas anday pacar kaya dika anday dika rl sikapnya kaya dika pilem	2
1	nonton film imperfect	2
1	film imperfect kim jennie as rara	2
1	why oh why did people only film imperfect excuse me wan na hear the other one	2
1	why oh why did people only film imperfect excuse me wan na hear the other one	2
1	nonton bareng tim kiss fm film imperfect xxi rcw loo tungguin updatean kegiatan nobarnya timeline rekan sebaya	2
1	ngobrolin film imperfect nonton film ernestprakasa	2
1	nonton bareng tim kiss fm film imperfect xxi rcw loo tungguin updatean kegiatan nobarnya timeline rekan sebaya	2
1	ngobrolin film imperfect nonton film ernestprakasa	2
1	penulis meira anastasia banyak benturan suaminya komika sutradara ernest prakasa menulis skenario film imperfect	2
1	penulis meira anastasia banyak benturan suaminya komika sutradara ernest prakasa menulis skenario film imperfect	2
1	jakarta juni bersamaan presscon film imperfect produser starvision chand parwez servia produser ernest prakasa penghargaan bene dion sutradara ghost writer atas	2
1	meira anastasia banyak ambil penulisan naskah film imperfect	2
1	mbak jessiga mila akn main film imperfect hehehe	2
1	sutradara ernest prakasa berkolaborasi istrinya penulis meira anastasia penggarapan skenario film imperfect	2
1	aq lbur badan dh kek film imperfect	2
1	nonton film imperfect	2
1	film imperfect selasa bioskop city	2
1	jessica mila film imperfect naikin bb kg sehat sebulan yukk yukk naikin kg sehat sebulan	2
1	aq lbur badan dh kek film imperfect	2
1	nonton film imperfect	2
1	film imperfect selasa bioskop city	2
1	jessica mila film imperfect naikin bb kg sehat sebulan yukk yukk naikin kg sehat sebulan	2
1	nonton download film imperfect rara jessica mila terlahir gemuk berkulit gelap musibah link download click here selamat menonton	2
1	coba cek videonya jessica mila proses penggemukan badan syuting film imperfect kg bulanan benar pola menu makannya diturutin	2
2	jajal dunia akting sivia azizah tertarik main film nkcthi	2
2	menyebut nama film nkcthi	2
2	rilis single akhir arah didapuk isi ost film nkcthi	2
2	banget lagunya nadin amizahsorai salah soundtrack film nkcthi	2
2	official teaser poster film nkcthi terbang pesawat kertasnya awan ketemu	2
2	official poster film nkcthi	2
2	film nkcthi berkisah amanat ayah anak film dijadwalkan tayang film nkcthi karya ketiga belas visinema rumah produksi terkenal film filosofi kopi	2
2	film nkcthi kisahkan pesan ayah anak sulungnya	2
2	menyikapi film nkcthi	2
2	film nkcthi	2
2	oka ajarkan tanggung anak film nkcthi	2
2	baru sadar soundtrack film nkcthi playlistku	2
2	bedah karakter film nkcthi kale si pembawa warna hidup awan via	2
2	cari karakter ardhito pramono kale film nkcthi yuk ma	2
2	film nkcthi rilis bioskop januari saksikan web seriesnya dibintangi wafda saifan	2
2	hindia ardhito gamau collabs beneran tolong banget film nkcthi sih	2
2	rachel amanda belajar arsitektur film nkcthi	2
2	awan salah karakter film nkcthi ka	2
2	gua film nkcthi filmin toyta	2
2	mas angkasa awan awan cerita mas angkasa tau pikiran awan episode nkcthi the series youtube cerita awan ikuti perjalanannya film nkcthi tahun	2
2	sadar memiliki baru menyadarinya kehilangan semesta banyak nkcthi the series episode tayang youtube toyota indonesia ikuti perjalanan awan dunianya film nkcthi	2
2	pamer undang preview film nkcthi	2
2	nonton film nkcthi	2
2	xxi epicentrum dikit ardhito premiere film nkcthi mojoklah gue sendokur lounge eh dagang obat jembreng praktekin gue	2
2	film nkcthi bikin iri	2
2	film nkcthi tayang si	2
2	nax tengh tengah sosok aurora dlm film nkcthi kek anjeer kek gua banget sellu nahan iri si bontot perhatian dijemput pas tk gegara mak bpa lupa sangkin asiknya ngurus si bontot	2
2	eh bru tw film nkcthi tayang	2
2	rachel amanda mengaku kesulitan membangun chemistry ardhito pramono film nkcthi	2
2	trivia yandy laurens sutradara film nkcthi	2
2	film nkcthi film nksthi sambat	2
2	nyari ttg film nkcthi nyangkut taz vs sabu	2
2	komitmen resiliensi visinema bikin film nkcthi	2
2	angga dwimas sasongko buruburu penggarapan film nkcthi	2
2	kaget td pas nntn film nkcthi adegan tmnku tatapan lsng ketawa untung ngk nntn bareng mas jogja city mall	2
2	baca buku nkcthi baru sadar isyana diawal akhir film nkcthi anak awan nerima surat ibunya	2
2	ooooo ost film nkcthi	2
2	hindia dengerin grgr film nkcthi	2
2	ngobrol ttg film nkcthi nyokap doi ngomong loh awan banget	2
2	teori konspirasi dibalik nama pemeran film nkcthi thread	2
2	kale dibalik elak pantes orangorang kayak kale film nkcthi kejelasan hobinya meng elak	2
2	tuh apasih awan film nkcthi	2
2	habis nonton film nkcthi berasa kaya si kale tu rese wkwk rese gituin kaya gatau wkwk	2
2	bagianku hatimu kaya mba isyana film nkcthi	2
2	film nkcthi	2
2	gimana nonton film nkcthi kirim pesan link ayo dicoba pesan kirim dikirim gmail dikirim dimasa loh coba bacain pesan lucu banget sedih baper	2
2	film nkcthi	2
2	min sekian menjelang proses produksi film nkcthi	2
2	film nkcthi soundtracknya rehat	2
2	film nkcthi ost ntar rehat ni keknya	2
2	kyaaa rehatnya kunto aji ost film nkcthi	2
2	rilis film nkcthi generasi an	2
2	film nkcthi cerita diproduseri michael chow	2
2	wkkw dhito main film nkcthi	2
2	rachel amanda perankan awan film nkcthi	2
2	ardhito pramono menyangka ditawari bermain film nkcthi	2
2	chico jerikho putri marino beradu akting film nkcthi	2
2	angga dwimas sasongko terapkan audisi berbeda film nkcthi	2
2	uwuwuw ardhito film nkcthi	2
3	gundala mengundang temanteman diikutsertakan closing credit film gundala yuk upload versi temanteman	2
3	sutradara mengundang bikin lagu closing credit film gundala takis	2
3	kayaknya dibagiin waktu launchingnya film gundala deh bentuk kertas	2
3	nonton film gundala putra petir	2
3	main film gundala tara basro baca komiknya	2
3	makna lagu the end of the world film gundala	2
3	reposterkini info film gundala	2
3	teaser film gundala koh	2
3	taun an film gundala	2
3	film gundala tayang agustus	2
3	jelang tayang pemain film gundala sambangi bandung sapa penggemarnya	2
3	video pemain film gundala sapa bandung meet greet foto penggemar braga city walk	2
3	temantemansiapa nih kemarin event meet and greet pemeran film gundala pasar komik bandung kenalan muzakkiintip yuk aksi muzakki	2
3	film gundala adu akting cecep arif rahman putranya	2
3	temantemansiapa nih kemarin event meet and greet pemeran film gundala pasar komik bandung intip aksi muzakki yuk	2
3	pemain film gundala sapa bandung meet greet foto penggemar braga city walk tribun jabar	2
3	sabtu kemarin pemain film gundalaofficial mampir bandung mengajak sahabat raka nonton film gundala tgl agustus film sutradarai	2
3	podcast on sunday menyelami joko anwar seputar film gundala rilis sebentar	2
3	pemeran film gundala mendadak hadir acara kelas kreator digelar tvone youtube coco space jl dipati ukur kota bandung sabtu	2
3	film gundala putra petir karya rencananya dirilis agustus bertepatan tahun komik gundala terbit hasil karya	2
3	muncul karakter baru harus ketahui film gundala	2
3	gua foto film gundala	2
3	harus film gundala	2
3	film gundala rilis baiknya	2
3	mon maap inget beras film gundala disuntik serum amoral	2
3	theory alasan film gundala rumah perdamaian daerah priok tugu peringatan perdamaian wilayah mahal harganya	2
3	film gundala tau	2
3	semoga kedepannya film gundala ptj	2
3	spoiler villain film gundala selanjutnyamanusia amuba	2
3	sjw main film gundala sjw tejo xixixixiampun mbah	2
3	itok kau dk ngerti jokesnye nantek ku donlotkan film gundala	2
3	well film gundala sih security ilmuwan gundala lu mahasiswi itb anak stan nikah rika tau deng	2
3	talkshow mas founder caravan studio caravan studio studio membantu pembuatan concept art film gundala	2
3	ngomongin privelege inget film gundala pas adegan mobil kaya adopsi sancaka coba sancaka sancaka ilmuwan terkenal security perusahaan koran bangkrut	2
3	film gundala jaff isa joko anwar ridwan bahri asli	2
3	film gundala	2
3	segenap crew film gundala selamat raya idul fitri maaf lahir batin selamat berkumpul keluarga image by	2
3	film gundala putra petir	2
3	fakta mencengangkan film gundala	2
3	kaos merchandise film gundala	2
3	terkait char bl revolusi buku prolognya keluaran dibeli official tokpednya film gundala banyak ngambil elemen universe komik revolusi satpam filmnya ngebentuk	2
3	you may be wondering why the red suit well thats so bad guy cant see me bleed deadpool mudahan deadpool muncul film gundala	2
3	nextjin kartubietapi kartubikayaknya sri asih film gundala garapan jengsiapa kah pemerannyaaaaaayo sri asih fans club ngumpul	2
3	fakta menarik film gundala putra petir	2
3	vol vol patriot origin gundala godam sri asih merpati usut usut karakter ditease hadir film gundala agustus	2
3	sayapsayap sang garudadi atas samudera langit khatulistiwasemoga namamu ujung duniaceritakan indahnya indonesia twentyfirst nightikuti info terkini seputar film gundala	2
3	film gundala libatkan pemain	2
3	cuman kemarin pas film gundala nyoba cari ketemu	2
3	indonesia we went in population order to hopefully get an easy start we mostly asked our friends what indonesian films do you like because we have friends like that also liked the look of new superhero film gundala but was only released months ago	2
3	releasenya film gundala kak	2
3	dipakai film gundala waktu credit title	2
3	cuman tau karakter sri asih detik film gundala coba	2
3	kayaknya rs kelam film gundala si pincang memiliki muda kelam tuanya pembunuh berdarah dingin	2
3	download film gundala iya berhasil gundala jaman anjay	2
3	smlm gue mimpi gue shooting film gundala gue ntn gundala gue gr shooting temenan tara basro alhamdul	2
3	sutradara film gundala pengabdi setan singkat	2
3	bedah film gundala postjulid tweets	2
3	kaya filmnya postcredits scene markinjut alias mari thread barubedah film gundala lagipostjulid tweets	2
3	lanjutan bedah film gundala julid	2
3	markinjut alias mari lanjutbedah film gundala lagijulid	2
3	download film garis birudownload film google drivedownload film gundala full moviedownload film giedownload film gundala download film pki full gratisdownload film pkidownload film pki	2
3	nonton film gundala lensamovie	2
3	kayak film gundala	2
3	ki wilawuk virus corona akhir virus film gundala sengaja	2
3	virusnya film gundala	2
3	conspiracy corona virus benar dikasih vaksin kek film gundala gimana yaaa	2
3	film derangedimdb sinopsis kasusnya kaya film gundala dimana perusahaan obat sengaja nyebarin virus masyarkat cuman obatnya ayah harus berjuang anaknya virus	2
3	jual beli serum kaya film gundala	2
3	berasa kek film gundala yah	2
3	iyaaa banyak orangorang muncul film gundala kemarin	2
3	serum amoral film gundala koreaini manusia moral gan	2
3	baju sancaka film gundala tersedia buruan serbu	2
3	berkenan menonton film gundala agustus memerankan salah karakter karakter anakanak pengkor jenar	2
3	buset deh berasa jahatnya film gundala gua haha	2
3	gara film bang joko anwar ngincer abimana film gundala hmhmm	2
3	film gundala butuh sosok pembantu akhirnya dijadiin kekasih nitip foto mas	2
3	harapan candu masyarakat candu berbahayapengkor film gundala	2
3	pendapat penonton gundala tiff menuangkan pendapatnya media sosial setelh menonton film gundala coba baca penasaran	2
3	wowapa pendapat penonton toronto internasional film festival tiff menonton film gundala yuk pendapat menonton film gundala	2
3	yuk ikutan nyimak obrolan seru film scoring sound design film gundala rooftop sound crossfade audio post behind the music and sound of gundala digelar kampus uic collage bsd sabtu sept	2
3	virgo and the sparklings tayang film gundala bumilangit studio	2
3	kpi promo film gundala semprit selengkapnya website kanal youtube qa metro tv	2
3	nonton bioskop topup tix id nonton film gundala males ngantri nonton film joker hadir topup tix id sistem mmbc cashback rp mudah	2
3	kpi gatau yah bangsat tuh laipstail anak twitter jauh promo film gundala baru nnton and ni huhu	2
3	ibuku maksa pakai kudung sih hahaentah violence bentuk animasi menurutku diterimakalo asli agak ngeri gitukejadian pas nonton film gundala anak minggu ketakutanpas nonton fairytale anteng	2
3	karakter film gundala suka kpopawangawang nobody nobody but you	2
3	berasa syuting film gundala gundalanya	2
3	pembukaan film gundala nih	2
3	film gundala karya bang	2
4	kaya film garis biru kayanya wkwkwk	2
4	kemarin nge skip kuis giveaway tiket premiere gala premiere film garis biru muluu nyadar laa gabakal cus jkt galprem maklumga tinggal ibukota	2
4	tribunwiki film garis biru kontroversi profil penulis skenarionya ginatri noer	2
4	film garis biru durasinya centang birumu	2
4	film garis biru sound locked	2
4	film garis biru	2
4	zara pengumuman premiere film garis biru epicentrum bd foto tiket premiere	2
4	lupa post hbd keberapa sih semangat jeketi blabla cepat grduate btw poster film garis biru tahun nih	2
4	terpilih pemain utama film garis biru zara jkt adik kyla jkt	2
4	terpilih pemain utama film garis biru zara jkt adik kylajkt	2
4	film garis biru	2
4	maksutnya kakek pemeran film garis biru	2
4	film garis birudia perannya dara keluarga cemararemakedia perannya euis anaknya emak abah	2
4	lupa saksikan film garis biru tanggal july bioskop kesayangan bums	2
4	lewatkan shopee live spesial ngobrol bareng pemain film garis biru aplikasi shopee giveaway tiket premiere garis biru pemenang loh aktifkan fitur ingatkan ketinggalan	2
4	btw film garis biru gengs film terbarunya gina noer	2
4	oalaah salah moco wkwkwk mocone si aril rekonen film garis biru wkwk theater wkwk	2
4	layah minggu dibahas salah base twitter film garis biru petisi ruang dialog terbuka menyimpulkan rencana akhir tahun sempet gagal gara petisi untungnya dicabut	2
4	kayak petisi film garis biru wkwkwk film edukasi film porno so sad	2
4	ttd petisi nga nayangin film garis biru goblog benar yee tinggal dimanasi klean ttd petisi gitu emang film vokep nora anying	2
4	dinamakan film garis biru terinspirasi testpack	2
4	kirain film garis biru	2
4	cem macem menolak film garis biru mendorong kpu usut kpps meninggal petisi setuju daenerys ratu naikkan sansa stark gitu des hoho	2
4	film garis biru rilisnya	2
4	astagfirullah baru tau film garis biru hamil chat sebodoh akuuu	2
4	pekok abangnya kemakan film garis biru	2
4	mantan blg deksisi anya geraldine aq zara jauh pas gapake makeup samsek kaya film garis biru wqwqwq	2
4	kemarin malem abis nonton film jenny juno youtube film muncul garagara nonton trailer film garis biru film jenny juno tuh film garis biru jenny juno muncul deh homeku	2
4	grgr film garis biru	2
4	film garis biru tayang	2
4	woee nonton sadar si adenya dilan si disa main film garis biru bandel yaaa adeknya	2
4	random inget film garis biru my head can anybody tell me remix version	2
4	update terbaru mencari link download film garis biru download link link nonton film bioskop gratis	2
4	sedihan film garis biru garis biru whatsapp online lokasi goa langse diyogyakarta daerah istimewah kota yogyakarta	2
4	cowoknya waktu nonton film garis biru kelewat tayangnya belajar tuh	2
4	hs film garis biru tayang	2
4	dibikin film garis biru mempan dikasi edukasi mediapun gentar susah indonesia mah heran ajigteh	2
4	baru film garis biru	2
4	adiknya main film garis biru	2
4	diskusi film garis biru tu beneran sih gituu	2
4	mencari link download film garis biru download link link nonton film bioskop gratis	2
4	nnton film bumi manusia duduk barisan ngelive ala film garis biru	2
4	sinopsis film garis biru	2
4	download film garis biru kualitas webdl	2
4	mah atuh ondel ondel film garis biru	2
4	film garis biru durasinya centang birumu	2
4	nonton film garis biru suaranyaaaa gimana guys bagus beloomm	2
4	disaat mah nonton film garis biruaku mah boro boro chat ajah centang abu abu alias read	2
4	nonton film garis biru trailernya film ellen page juno gitu sih	2
4	angga yunanda zara jkt dikabarkan dekat sekedar teman beradu akting film garis biru	2
4	alurnya kek film garis biru wkwk	2
4	gbt link streaming film garis biru ak cari google nemu	2
4	film garis biru dinamain garis biru maksudnya garis biru tespek tespek hamil garis merah biru	2
4	film garis biru durasinya centang garis birumu miris ah	2
4	nama bima li bima film garis biru bima desa penari begono semoga mengikuti bima bima wkkw	2
4	wp suka angga zara film garis biru dibaca yuk	2
4	pemeran wanita utama film garis biru adhisty gaara	2
4	film garis biru mai	2
4	oh main film garis biru artis mah beda foto ktp cakep	2
4	oh lanjutan film garis biru kemarin wkwk	2
4	tespect film garis biru	2
4	kisah film garis biru menyebabkan kehamilan usia centang biru menyebabkan perjuangan berhenti	2
4	nonton kak film garis biru	2
4	garis biru menceritakan pasangan muda dara zara bima angga perbuatan terlarang dara hamil kehidupan berubah menurutmu pesan moral film garis biru	2
4	pembicara bpk hasan anshori rita wulandari editor film garis biru moderator	2
4	sinopsis film garis biru film membuatkontroversi	2
4	jaketnya film garis biru wkwk	2
4	ngantri klinik inget film garis biru	2
4	pesan teteh lupa pakai pengaman bintang film garis biru baik nina ninu dwernya sah kayak teteh	2
4	min link download film garis biru min	2
4	nobar tau theater visit film garis biru shock pas anggarachel amanda lupa kawannya zara	2
4	film garis biru kuliah korea biar ketemu oppo	2
4	gue kejadian pas premier film garis biru	2
4	contohnya kaya film garis biru pas scene ortu bima rumah dara ngelamar pas suasana tegang app ojek onlinenya bima bunyi jalan buntu silahkan putar tangkep scene sih jalan nikahin si dara	2
4	tragedi abis nonton film garis biru cewe mah gaada harganya gaada rahim ndatau gimana perasaan cewe ngalamin	2
4	film garis biru menceritakan chat diread doang	2
4	kaya pendahulunya film garis biru sih	2
4	angga film garis biru iya kau	2
4	haruto ava lo kayak film garis biru	2
4	hamil grgr nonton film garis biru alias anjeng nular	2
4	download film jack the giant slayer download film jigsaw download film jack the giant slayer sub indo download film jaga pocong lk download film jelita sejuba full movie download film garis biru download film gratis download film kuntilanak	2
4	film biru ki sedulure film garis biru	2
4	dara film garis biru	2
4	gambar diatas scene film garis biru	2
4	gue telat banget baru streaming film garis biru	2
4	semiotik film garis biru	2
4	uda nonton film garis biru geli gimana gitu wkwk aneh gue	2
4	kayaknya film garis biru	2
4	film cher james zara film garis biru	2
4	adhisty zara ariella calista ichwan cindy hapsari maharani pujiantoro putri jkt film garis biru	2
4	film garis biru tu maksudnya gimana hamil gitu	2
4	gua baru nyadar film garis biru tuh maksudnya garis biru alat tes kehamilan iya	2
4	abis nonton film garis biru bini basah	2
4	tahun minat nonton film bioskop nonton film garis biru mantan gue tnggal juli tepatnya	2
4	hehehe ngedit tanggalnya doang sih booking suruh mas masnya puterin film garis biru	2
4	baru kelar nonton film garis biru ngehin kaya kenal gedung sekolahnya familiar benar gedung jaman sekolah romannya gapernah dipakai syuting an	2
4	link download film garis biru webdl hd full movie	2
4	film garis biru iflix wkwkwmkw	2
4	kontroversi film garis biru kucumbu tubuh indahku krisis sex education pikirannya keracun pornografi baru denger judul gitu mikirnya kemana	2
4	nonton film garis biru	2
4	please kedepannya kaya film garis biru	2
4	jumat gue unj acara sigma screening film garis biru tiket ceban	2
4	mama uwik follow angga film garis biru	2
4	film garis biru wkwk	2
4	beneran ngidol jaman film garis biru mbak	2
4	uks scene film garis biru	2
4	teaser sekuel film garis biru dara bima kebanyakan makan kerang kerang saaaja menantinya	2
4	film garis biru in rl	2
4	film mariposa dikaitkan lanjutan film garis biru pdhal beda cerita beb	2
4	sore baru nonton marriage story benar orangorang film efek bikin takut nikahnya ngelebihin efek film garis biru seremnya premarital sex efek film days of summer seremnya hubungan	2
4	tangganya bikin gua inget bima bimo film garis biru	2
4	merapat yuk bedah film garis biru bareng ukm pikma wiralodra sore auditorium universitas wiralodra cc	2
4	habis nonton film garis biru	2
4	film garis biru ganti film centang biru	2
4	film garis biru	2
4	adeknya dilan pergaulan bebas film garis biru bioskop isinya marvel layarnya marvel avengers	2
4	film garis biru kpn tayang	2
4	nama balie angkatan review guys tau film garis biru bentar tayang nonton film review film korea judulnya jeni juno film sih tahun filmnya nyeritain gimana anak	2
4	oh cok baru paham film garis biru	2
4	film garis biru wkwk	2
4	film garis biru on bioskop	2
4	film garis biru on bioskop	2
4	kaya ditanggapin min cuman buang enerji gimana ntar film garis biru da teasernya starvision main angga yunanda zara jkt	2
5	yuk simak behind the scene film anak garuda	2
5	markas anak garuda selamat pagi indonesia salah shooting film anak garuda tonton exclusive premierenya yuk tiket pesan wa yuuukburuan kehabisan	2
5	film anak garuda suported by hdi	2
