5	barusan nobar nih film seru kocak hahahahaha inspiratif banget	1
5	wajib nontn guys filmnya bagus banget	1
5	filmnya bagus terharu film mendidik perjlnan langkah kaki manusia film kisah dlm kehdpan manusia berbeda	1
5	sarat pesan moral bagus belajar kepemimpinan problem solving	1
5	cakeeep suka	1
5	karakter kelebihan bikin gue kagum banget	1
5	kereeen banget banyak value hidup diambil film	1
5	mantap filmnya bahasa campuran indonesia jawa sneng pas ngomong jancok	1
5	bagus banget nonton bioskop tayang perdana jam film bagus bangetttt dibioskop anak garuda harus indonesia indonesia indonesia sad sad gitu pas paris kenal yohana nangis gitu omg tayang tanggal januari bagus deh filmnya buruan nonton temen temen	1
5	suka film isinya perjuangan anak anak bisamewujudkan cita cita cerdas bisamewujudkan cita cita salut anak anak spi anak anak sooooo	1
5	nonton filmnya filmnya keren bagus banget suka banget film	1
5	bagus banget gembira nangis nangis bagus bangettttt	1
5	film populer anak bangsa indonesia bermanfaat pesan moral	1
5	salah film edukasi terbaik wajib nonton	1
5	keren banget motifasi anak muda	1
5	wajib tonton yh sumpah filmnya keren sedih lucu pokoknya komplit wajib tonton yh	1
10	film bodyguard ugal ugalan menarik penonton butuh hiburan	1
10	baru tau tontonan bodyguard ugalugalan gokil hmm	1
10	cinta film bodyguard ugal ugalan filmnya bagus menginspirasi rakyat indonesia soundtracknya easy listening editannya setara film hollywood	1
10	film lucu gokil tuh bodyguard ugal ugalan	1
10	keren harus nonton gua habis keracunan bodyguard ugal ugalan butuh penawar cespleng	1
10	wkwkw mending nonton bodyguard ugal ugalan gan wkwkw	1
10	noton ku lari pantai bodyguard ugalugalan sumpah koki cilik bole	1
10	ayooo ahhh nonton bodyguard ugal ugalan	1
10	oiya kemarin tim penuh nonton bodyguard ugalugalan fenomenal	1
10	nonton bodyguard ugal ugalan sibuk smwa	1
10	film syahrini bodyguard ugalugalan keren banget ngakak akhir	1
10	keluarganya diajak nonton bodyguard ugal ugalan haha	1
10	antusiasme penonton bodyguard ugalugalan syahrini	1
10	abis nonton bodyguard ugalugalan dah gitu	1
10	bodyguard ugal ugalan receh sekalihaha banyak komedi miss sik hit syahrini cetar membahana chika jessica scene stealer banget ketawa nangis	1
10	sabtu nonton bodyguard ugalugalan	1
10	twist film bodyguard ugalugalan bagus ketimbang film target	1
10	baru nonton film inces bodyguard ugalugalan bioskop lucu abisss ngakak	1
10	jokes dipakai ngena banget bagus	1
10	keren komikakomika actingnya	1
10	mantap hiburan diakhir pekan melepas penat kerjaan	1
10	mantap nih punchline banyak ngena gua hahahahh	1
10	lumayan bagus laa	1
10	nonton masi ngakak parahhhh	1
10	berhenti ketawa nonton wkwk	1
10	mantap lumayan hiburan	1
11	brarti film rafathar bagus	1
11	bagus banget pokonya film rafathar mah	1
11	lebi suka film rafathar	1
11	oke ganti film rafathar efek cginya keren banget	1
11	bagusan film rafathar	1
11	film rafathar keren	1
11	benar banget rafathar film terbaik indonesia	1
11	edan film rafathar mantap bet cgi	1
11	film rafathar now on rcti akhirnya nonton	1
11	film kombinasi sempurna komedi menggelitik drama menyentuh hati action menegangkan gue tau harus bilang perfect	1
11	film bagusan rafathar the movie	1
11	film rafathar patut tunggu nih	1
11	filmnya lucu banget cocok banget ditonton keluarga huhu love rafathar	1
11	initinya film lucu banget	1
11	haha seruun nihh bkin ngakak	1
12	serius film horor indonesia banyak bagus update nonton serem tuh rumah dara kafir kuntilanak jalangkung abis update	1
12	pocong film kuntilanak series bagusan pas jamannya julia estelle benar si namanya	1
12	iya kuntilanak pemainnya julie etelle film sih seru seru silent hill lupa nonton	1
12	iya kuntilanak serem lucu iya	1
12	pas gue angkat suara kuntilanak banget anjier ketawatawa kayak film gue heboh takut campur bingung setan tlp gue manggil adek gue temen gue dengerin takut wkwkwk iyalah	1
13	yaeyyyy rangga hanum bersatu keren bangetttt film akting mewek terbaik banyak pelajaran diambil film	1
13	transtv film hanum rangga bagus sih inget drama bu ratna sarumpaet ketawa mulu bawaannya	1
13	habis nonton film hanum rangga film inspired banget tersentuh harus rangga sih dadi kelingan sik mbiyen mbiyen	1
13	film hanum rangga bagus fiksi film menceritakan kisah hmmzzzz	1
13	film tv bagus bagus preman pensiun hanum rangga keluarga cemara	1
13	sependapat its oke either you are not moslem or even you are moslem penikmat seni gue menilai film bagus sisi nilai kehidupan gue pribadi suka terjun intrik perasaan rumah tangga hanum rangga	1
13	eeeeaaaaa setuju film bagus wajib tonton milea hanum rangga kabooooor	1
13	harusnya tulisannya berdasarkan novel laris asma nadia mbak kemarin muji film hanum rangga bagus	1
13	film tonton benarbenar bagus hanum rangga	1
13	reviwe film hanum rangga faith and the city asli boong film bagus kebiasaan pemerannya abimana adaptasi pemerannya rio dewanto bagus aktingnya kusukaaaa	1
13	suhu politik ngaco film pautin pandangan pilihan politik man called ahok hanumrangga samasama bagustinggal selera pilih nonton seret perbedaan politik	1
14	sumpah film indo benar benar cginya bagus nga kayak garuda superhero wkwkwkw	1
14	mendukung indonesia superhero kayak ksatria garuda bagus film anak sayang jam tayangnya jam sekolah	1
14	kesini menyadari betapa bagusnya film garuda superhero untung nontonhaha	1
14	garuda the new superhero bagus tu direview masi bagusan film masterpiece si aa	1
1	rilis trailer masi terngiang ngiang film imperfect meira fokus gue tagline aka ubahinsekyurjdbersyukur simple agak berat ud fase insekyo complicated wkwkwk dasar	1
1	teruss suka insecure saranin tonton film imperfect filmnya main jessica mila	1
1	rilis trailer masi terngiang ngiang film imperfect meira fokus gue tagline aka ubahinsekyurjdbersyukur simple agak berat ud fase insekyo complicated wkwkwk dasar	1
1	teruss suka insecure saranin tonton film imperfect filmnya main jessica mila	1
1	tunggu nonton filmmu yaaa nonton film ernest bioskop tau pas nonton film imperfect temennya	1
1	penasaran film imperfect	1
1	barusan poster film imperfect cast cantik gemuk bilang waaaw kereeen waaw lucuu hoaa cubit keliatan double chin katain setrika noh dagu biar lempeng	1
1	penasaran film imperfect	1
1	barusan poster film imperfect cast cantik gemuk bilang waaaw kereeen waaw lucuu hoaa cubit keliatan double chin katain setrika noh dagu biar lempeng	1
1	nunggu film imperfect aj dah ane	1
1	nungguin film imperfect bgtbgtbgt	1
1	nonton film imperfect bagus banget kayaknya	1
1	kadang baikbaik sabar nonton film imperfect	1
1	nonton film imperfect bagus banget kayaknya	1
1	kadang baikbaik sabar nonton film imperfect	1
1	trailer film imperfect rilis ceritakan perempuan fisik mencintai	1
1	wajib kudu banget nonton film imperfect	1
1	film imperfect mah ubah insecure bersyukur	1
1	habis nonton trailernya film film imperfect dialog bilang jelek lo gabakal ngerti shit that hurts	1
1	film imperfect diajarkan otak kurang penampilan film nkcthi diajarkan otak kurang attitude	1
1	gara film imperfect ost pas credits lagu fiersa besari ngedengerin lagunya pop banyak ngehujat yah kuping pop melankolis indo beralih gitu kurangterlalu indie sih	1
1	dibina pengurus rohisnya doktrin intolerans ajak nonton film imperfectbiar terbuka wawasan pokoknya didiamkan dianggap	1
1	if being perfect is your happiness give me time because already love your imperfections film imperfect juara banget	1
1	inget film imperfect transit cgk hours wkwk	1
1	film imperfect diajarkan otak kurang penampilan film nkcthi diajarkan otak kurang attitude	1
1	gara film imperfect ost pas credits lagu fiersa besari ngedengerin lagunya pop banyak ngehujat yah kuping pop melankolis indo beralih gitu kurangterlalu indie sih	1
1	dibina pengurus rohisnya doktrin intolerans ajak nonton film imperfectbiar terbuka wawasan pokoknya didiamkan dianggap	1
1	if being perfect is your happiness give me time because already love your imperfections film imperfect juara banget	1
1	inget film imperfect transit cgk hours wkwk	1
1	abis nonton film imperfect alvin disalah scene dimana rara ngaca dicerminnya tulisan dont stop untill youre proud tuh simple bermakna banget	1
1	keliatan cakep film imperfect blg gitu	1
1	kecantikan segmentasinya sendirisendiri tergantung selera kak ketidaksempurnaan dilarang menjadikan kufur nikmat minder sesuai tagline film imperfect ubah insekyur bersyukur	1
1	film imperfect ngaco banget dah keren cui pgn nonton relate banget gue	1
1	film imperfect mengerti tua ajarkan maksudnya baik emang kebaikkan yah kadang salahga sesuai sih harusnya td mak gue ntn biar sadar wkakakak becanda mak	1
1	film imperfect tonton dah seru tau	1
1	film imperfect sebagus salut karakter peran dika rara	1
1	gila keren banget film imperfect perfect	1
1	kesimpulannya gue bingung nyimpulin kesimpulan film imperfect cantik harus mensyukuri gitu ah	1
1	berpikir sempurna film imperfect	1
1	semenjak nntn film imperfect ngegas luv jumi	1
1	kemarin waktu nntn film imperfect film bilang anjing ni film isinya hidup gue	1
1	dika mencintai segala ketidaksempurnaan padaku dunia menuntutku wanita sempurna korban film imperfect	1
1	sore menonton film imperfect film cerita menonton resah penonton menertawai teman sebelah menangis teman ditertawai cepatcepat menghapus air matanya kegelapan	1
1	dika mencintai segala ketidaksempurnaan padaku dunia menuntutku wanita sempurna korban film imperfect	1
1	akhirnya nonton milly mamet movie hooqduh sebagus lucu banget suka banget drama kehidupannya ahhhhh sabar nunggu film imperfect nyapasti film nyentil banget	1
1	ihh gaboleh donggg coba deh kk film imperfect	1
1	ihh gaboleh donggg coba deh kk film imperfect	1
1	ngasih dapetin dinner bareng crew mgtradio plus nonton bareng film imperfect stay tuned	1
1	film imperfect benerbener bikin bingung pas nonton pikiran berasa sisi kontradiktif sisi insecure emang salah bersyukur salah harus berusaha memperbaiki kehidupan sosial penampilan emang	1
1	film imperfect ramai banget yok	1
1	film imperfect keren banget film indonesia bagus bagus euy terimakasih tina ditraktir nonton semoga rejekinya banyak nraktir nonton oiya lupa tina main twitter gpapa dah	1
1	musti sabar nunggu film imperfect ko ernest akhir taun	1
1	jessica mila ditawari bermain film imperfect menyadari isu body shaming disepelekan	1
1	lu keren koh panutan generasi muda mimpi nge direct film goodluck film imperfect	1
1	baca mereun inget cuplikan film imperfect eh kerjaan	1
1	inii nih nntn film imperfect	1
1	tonton film imperfect deh bagus	1
1	rara film imperfect baikbaik dunia sopan	1
1	baca mereun inget cuplikan film imperfect eh kerjaan	1
1	inii nih nntn film imperfect	1
1	tonton film imperfect deh bagus	1
1	rara film imperfect baikbaik dunia sopan	1
1	imperfect ernest prakasa bersyukur akhirnya nonton imperfect menjelang turun layar predikat film terlaris indonesia tahun film imperfect acting cast bagus supporting cast menang mencuri perhatian	1
1	lagu lagu keluarga cemara aaa nonton si zahranya cantik guys nonton nonton ngajak keluarga	1
2	film nkcthi nampaknya berpotensi menyamai rekor dilan syarat mengemas film menarik menghilangkan esensi bukunya film superhero gundala sukses itupun gundala berhasil memikat hati penonton	1
2	reading film nkcthi semangat iaa	1
2	film nkcthi pemainnya ardhito pramono habislah terkoyakkoyak perasaan	1
2	sabar film nkcthi dito my luv	1
2	ardhito main film nkcthi parah sih harus nonton	1
2	plis gasabar pgn nonton film nkcthi banget sih tahun	1
2	uuuu film nkcthi ardhito	1
2	arah music merilis single akhir resmi ost film nkcthi tayang tahun dikemas lagu bergenre power pop segar lagu menggambarkan kebersamaan mencapai tujuan yuk dengarkan	1
2	membayangkan film nkcthi seanget sewangi	1
2	film nkcthi seisi dialognya quotes gitu	1
2	semoga rezeki umur bertemu awan film nkcthi	1
2	sabar nonton film nkcthi	1
2	film nkcthi kayanya seru banget tayang nonton pokoknya	1
2	pnsrn banget film nkcthi	1
2	film nkcthi menarik perhatian gua ost make lagu rehat mzkun penasaran	1
2	film nkcthi kayaknya mewek banget sih cocok ditonton biar mewek malu	1
2	film nkcthi pakai soundtracknya mantra mantra seambyar apaaaa coba tu film tuuu	1
2	thank you bang first listening lagu fine today sesi live jam pagi sukses film nkcthi nyaaa berkarya bang ohyaa sharing lagu jazz lawas makasih	1
2	galau gara nunggu film nkcthi huhu cant waittt	1
2	derita gue anak tengah terwakilkan film nkcthi cant wait to watch	1
2	keracunan lagunya hindia gara nonton teaser film nkcthi ambyar pas nonton video clipnya youtube bacain komen	1
2	film nkcthi wish list film harus ditonton tahun	1
2	seneng film nkcthi soundtracknya lagu hindia hiyahiyahiya sih bye	1
2	dah sabar nonton film nkcthi daahhh	1
2	episode series appetiser menggoda berhasil banget bikin ngiler nunggu kedatangan sajian utamanya si film nkcthi penasaran kisah keluarga angkasa awan gimana diceritakan filmnya sabar	1
2	kecakapan tim dlm ceritavisual oke banget berangkat kutipan buku nkcthi film nkcthi refleksi muhasabah anak kakak adik surat cinta sayangi	1
2	begimana sembab perjalanan jauh motor hmmm film nkcthi worth it banget sih terkejut sebegitunya ceritanya nonton lupa bawa tisu	1
2	baru trailernya merinding nebak rahasia keluarga film nkcthi pecah keren masss	1
2	baca seneng banget bikin tenang tu benar benar bikin seneng jugaaak pas insecure nanyain nobar film nkcthi berlanjut bahas kuliahan sambat segala keluhannya seneng banget	1
2	film nkcthi bagus	1
2	ngajak mama nonton film nkcthi	1
2	kemarin mantra mantra live film nkcthi jujur lelah banget nangis mulu persediaan air tahun abis deh kayaknya	1
2	abis mantramantralive malam wakacaw wakacaw hati batuku terbubuque bubuque film nkcthi plis januari harus nonton plis	1
2	ii gasabar nonton film nkcthi dah	1
2	terbayang film nkcthi gakmau gue kaya gitu kisahnya deh aq mending mundur mas gitu	1
2	film nkcthi bentar rilis nemenin gua nonton gitu hahahahhahahaahanjingngenes	1
2	penasaran film nkcthi	1
2	sbr film nkcthi	1
2	film nkcthi diharapkan penyemangat hidup	1
2	intinya pgn beli tiket film nkcthi tu film biar penonton	1
2	menaruh ekspetasi tinggi film nkcthi garap visinema	1
2	suka memodifikasi karya karya bagus filkop keluarga cemara semoga visinema benarbenar film nkcthi cerita brilian setau buku ignya berisi kutipan	1
2	anjir film nkcthi kayanya film indo gue tonton salah film indo watchlist gue	1
2	film nkcthi karya terbaiknya	1
2	nangissss banget ngehati film nkcthi yaampun konfliknyaa mantap	1
2	gini relate banget film nkcthi posisi angkasa	1
2	kemarin diajak nonton gratis film nkcthi gamaugasuka galau td barusan nonton langsungg bahas film	1
2	sih bilang film nkcthi jelek hatinya terbuat	1
2	inget film nkcthi gimana bahagia sedih gatau kaya gimana btw kuat mbak	1
2	sodorin film nkcthi biar tuh paham how feel	1
2	kemarin nonton film nkcthi otak inginan artis gitu bayang ardhito jiakhahaha haluu tingkah dewa pagi met pagi ol	1
2	korban nonton film nkcthi iki	1
2	film imperfect diajarkan otak kurang penampilan film nkcthi diajarkan otak kurang attitude	1
2	oke gue akuin si film nkcthi diluar ekspetasi gue parah kek kirain gue film kek ecek gitu pas gue nonton bangsattttt banget alur ceritanya	1
2	nonton film film nkcthi	1
2	film nkcthi kale pas ngomong relate alias berak lu sekebon	1
2	aseli film nkcthi kaya idup wkwk	1
2	iyaaaa mangkanya waktu nntn film nkcthi nyanyi ak histeris saking enaknya teriak si sbnernya kek seneng gitu owkayy dengerinn	1
2	film nkcthi pas angkasa ngomong anak band gada benar tu keinget omongan mama pas lololollll dlm hati uda kek anjirrrrrr why relate	1
2	memiliki ekspetasi film nkcthi pas nonton nangis film ahaha iya alay bagiku film benar rapi keren	1
2	terima kasih terima kasih film nkcthi	1
2	well bikin film nkcthi relate pas scene awan kenalan kale inget jaman kenal cowo anak band ortu ngomong anak band keliatan bentukannya mbois gitu tiati ntr gabener km	1
2	film nkcthi ceritanya bagus dekat kehidupan seharihari sadar pas nonton tibatiba air netes gitu	1
2	gitu gue point film nkcthi dialog kale gue mikir berkalikali emang statementnya bangsat sih sisi benernya kebahagiaannya tuh ketergantungan	1
2	bahagia lo nyari kebahagiaan salah inti kalimat diucapan kale aka film nkcthi setuju banget gila	1
2	film nkcthi koo pas rumah pas kebayang adegannya bawaanya nangis mulu gua doang	1
2	maghrib nangis gegara nonton film nkcthi barusan nangis abis kelar baca novel barusan banget nangis gegara kucing lumpuh bengep dah angel	1
2	gua pas denger film nkcthi kek inget kejadian bikin gua shock denger cerita bokap gua kek rahasia keluarga banget gua baru tau pas gua	1
2	skenario film nkcthi kakak tulis wahh sabar nunggu baru syuting	1
2	gasabar film nkcthi	1
2	cerita class by at sabar nonton film nkcthi	1
2	gue penasaran film nkcthi kyk gmn isi bukunya tulisan doang	1
2	td br cast film nkcthi uwow	1
2	gaksabar nunggu film nkcthi pas terinspirasi mimanya lulu gmn baca kakakku waktu temen ngelayat rumah gituuuuu	1
3	banyak terima kasih info film gundala doakan brur	1
3	temanteman bantu rtlike lagu thunder boy credit title film gundala garapan mas lagulirik diupload soundcloud didengarkan spotify terima kasih	1
3	temanteman bikin lagu closing credit film gundala yok	1
3	film gundala sutradarai mas joko anwar hmmm diagendakan	1
3	hmm tercium bau film gundala	1
3	sutradara penulis skenario terharu film gundala banyak tanggapan fanart mencapai karya	1
3	gundala tahun gundala difilmkan sutradara loh film gundala garapan joko anwar tonton bioskop indonesia tanggal agustus	1
3	interview foto session berhenti perut mulut kram tertawa menerus good luck film gundala mas marrisa anita	1
3	sutradara joko anwar kostum gundala aktor abimana aryasatya pemeran utama film gundala	1
3	kasih update film gundala bang joko penasaran keknya oot deh hahaha	1
3	mah menunggu film gundala	1
3	indonesia superherosukses film gundala beserta crewnyaikut meramaikan	1
3	lumayanlah posternya gue ngarepnya poster simpel kek gini kesannya kayak numpuk banget bagus film gundala lawannya agustus	1
3	hadir indonesia photoshoot share trivia seputar film gundala tungguin videonya yaaa temanteman	1
3	menunggu film gundala wkwkwk	1
3	abimana rio dewanto tara basro hadir memerankan karakter film keterlibatan cecep arif rahman memiliki jam terbang hollywood film gundala layak dinantikan tahun	1
3	btw happy birthday bang ditunggu film gundala perempuan tanah jahanamnya tahun sukses bang	1
3	kapolri jenderal tito karnavian sambut positif film gundala	1
3	temanteman menonton film gundala sekedar menonton film merasakan suara jernih dolby atmos seolaholah mengajak didalam film penasaran sabar temanteman agustus	1
3	film gundala film indonesia menggunakanan teknologi dolby atmos temanteman dolby atmos teknologi surround sound suara film terdengar	1
3	banyak rapper ngisi soundtrack film gundala keren filmnya karya joko anwar joko	1
3	as kostum gundala dipamerkan publik film gundala	1
3	ditunggu banget nih film gundalanya mas semoga lagu berhasil mewakili semangat perjalanan sancakagundala	1
3	film gundala tayang mengundang antusiasme tinggi banyak kepala kepolisian ri jenderal tito karnavian menggemari gundala calon perwira kapolri tito nama gundala baca selengkapnya	1
3	film gundala libatkan sebagaipemain	1
3	semoga film superhero indonesia bangkit kualitas cgi setara superhero hollywood harapan tinggi film gundala make cgi garapan hollywood pleasejangan cgi buatan indonesia maksimal hasilnya contohnya wiro sableng cginya kasar	1
3	april peluncuran prangko jagoan indonesia hadir ket bekraf komunitas komik blogger seni filatelis pegiat film gundala postcrossingkegiatan tsb diharapkan mendorong industri kreatif	1
3	bangga penonton rela antre saksikan film gundala toronto	1
3	mas kemarin nonton film gundala singapura pingin banget nonton akhirnya nonton	1
3	coba analisis semiotika dala film gundala disana banyak banget dikulik sih	1
3	nonton film gundala ngeh anaknya bumi langit mas imansyah lubis oyasujiwo cerita perjuangan butuh waktu tahun baru up quotes bagus banget cinta butuh keras kepala	1
3	film gundala mengurusi acuh thdp penderitaan setuju berlaku kenyataannya medsos campur urusan	1
3	nonton perbincangannya insight poin menarik joko anwar kelam medan pengaruhi karya gelap tergambar film gundala perempuan tanah jahanam tonton berkarya	1
3	mbak upi ngedirect film sri asih pevita pearce sebelahnya sancaka abimana aryasatya sang bang joko anwar director film gundalagak sabar lanjutannya gundalagundala putra petir	1
3	suka mas observasi teliti quote dialog film populer negeri coba bahas film gundala doa appreciate	1
3	kangen definisi kangen dievaluasi biar kaya alur film gundala putra petir	1
3	wkwkwk kirain arusnya kakwkwkwkok inget film gundala yo	1
3	meminjam tagline film gundalanegeri butuh patriotpatriot sekedar cinta bangga bangsanya patriot berdiri bangsanya berdiri bangsa	1
3	film gundala cameonya hasmi keliatannya bagus biar kek avenger cameonya stan lee	1
3	oke emang karakter nemo film gundala nemo komik kaya agung banget	1
3	kasian yh bang jokan promo film gundala malaysia tolol bacot	1
3	wahh selamat menonton film gundala saudara serumpun malaysia gundala sukses next film sri asih harus tayang serentak malaysia nih	1
3	film gundala menggarap tujuh film pahlawan super rumah produksi bumilangit studios screenplay picturessaksikan with besok wib	1
3	ujan petirnya kayak film gundala takut ntar ue kesambet penerusnya gundala	1
3	film gundala disutradarai diadaptasi komik gundala putra petir karangan harya suraminatatak sabar menunggu launchingnya film gundala layar lebar film superhero karya anak bangsa	1
3	film bergenre superhero mencuri perhatian penggemarnya agustus dirilis film gundala putra petir film garapan joko anwar diadaptasi komik	1
3	topik ngobrol pas ketemu sanak saudara seumuran film gundala rilis agustus karya hype laporan selesai	1
3	samasama min semoga film gundala sukses	1
3	hype film gundalagundala fanart by abdullah alfatah versi digital drawing versi manual	1
3	salah menyambut menunggu gundala hopefully temantemannya universe beraksi layar lebar film gundala bagusso here am welcoming with my regards	1
3	kehormatan tara basro terlibat film gundala	1
3	duh si film gundala keren banget sih	1
3	gundala fan art bikinan temanteman rencananya seijin pembuatnya tampilkan pameran gundala fan art gala premiere film gundala minggu keempat agustus	1
3	bumilangit cinematic universe mcu dceu indonesia tokoh jagoannya komiknya dibuka film gundala agustus	1
3	baru tau indonesia tuh mcu namanya bumilangit semenjak joko anwar rencanain bikin film gundala keren	1
3	moga film indonesia khusunya pakai teknologi cgi membaik film gundala dannnn terwujud universe	1
3	ditelepon film gundala	1
3	jokowi memanggil calon menteri berasa film gundala dimana pengkor memanggil anak	1
3	perempuan tanah jahanam film karya bang joko anwar tahun jujur menyukai film film gundala filmnya rapi ceritanya stabil alur	1
3	bangun tidur bangun berdua tidurnya emang terbukti benar kutipan film gundala tegak keadilan	1
3	oke pendekatan bang jokan film gundala gue jsb awang bocorin identitasnya sancaka and nothing happens	1
3	bersyukur gue menurunkan ekspektasi serendah perempuan tanah jahanam film gundala kemarin gue bioskop perasaan puas alias sukaaa banget film film joko anwar favorit gue pintu terlarang	1
3	karakter superhero indonesia salah satunya gundala banyak komik semoga menonton film gundala mengambil pesan moral film gundala selamat menikmati sahabat indonesia	1
3	kolosal gitu yah perang bubat adegan perang kayak adegan pas demo film gundala apik sih	1
3	film gundala sempurna no kritik	1
3	langit pagi serasa langit film gundala tau kelelawar	1
3	sidang pembaca budiman bedah film gundala semoga karyakarya baik memperkaya khazanah film jagoanjagoan indonesia pokoknya you have my sword my bow and my axe	1
3	salah kerennya film gundala scene ditake tau waktu syuting pakai studio they shoot on real locations	1
3	sugan teh film gundala ramai jiga ceuk beja ari pek hanas didonlot	1
3	baru nemu film gundala sekian keren banget siih	1
3	film gundala keren banget gila menyesal nonton bioskop	1
3	film indonesia gundala jalan ceritanya sains kaya gitu mbok film gundala pakai zat kimia genetikal dicampurkan beras rakyat	1
3	td ak try out bindo kerennya text ttg film gundala	1
3	scene favorit film gundala	1
3	penyakit obat keinget film gundala film aruna lidahnya deng flu burung	1
3	wabah virus corona keingat film gundala gegara nih adegan film dunia gundala negeri butuh patriot plis datangkan	1
3	beneran sih janganjangan kek film gundala	1
3	film gundala	1
3	naaaahhh relate tuh film gundala	1
3	ikutin virus korona de javu film gundala gatau	1
3	vaksin virus korona inget film gundala obat harus disebar daerah biar calon bayi terselamatkan plis gundala muncul didunia dunia membutuhkanmu	1
3	virus virus gini inget film gundala	1
3	hasil baik prlu trgesa nyantai lambatsewajarnya hasil boonginkarya tercipta mnjadi legenda dikemudian hariklo ngasih masukan bikin film membutuhkan tekhnik efek lbih wow film gundala ratusilumanlautkidul lain-lain	1
3	the best film gundala wajib diapresiasikan joko anwar cita ku mengharumkan nama bangsa film my idola	1
3	ngeliatin kereta berangkat tergoda bertingkah ngejar kereta ala film gundalaapalagi baru kereta sancaka utara	1
3	suka komik artworknya lhoo gambar seneng ngelihat gambar karya btw sukses film gundala malaysia	1
3	watch out marvel pendapat penonton film gundala toronto international film festival	1
3	iya benar nonton kebioskop nonton film gundala gundala tayang toronto internasional film festival tiff gundala tayang paris international fantastic film festival pifff	1
3	pendapat penonton toronto international film festival menonton film gundalakalau nonton baca pendapat merekajadi penasaran gundala tayang dimalaysia disember lupa ajak keluarga teman pacar biar seru	1
