5	tribunwiki profil tissa biani pemeran sayyidah film anak garuda bintang makmum	2
5	verdi solaiman butterfly pictures garap film anak garuda lifestyle	2
5	verdi solaiman butterfly pictures garap film anak garuda lifestyle	2
5	film anak garuda mengungkap kisah spi lifestyle	2
5	clairine clay perankan olaf korban kerusuhan poso film anak garuda	2
5	syuting film anak garuda perancis clairine clay bawa saset sambal membawa	2
5	main film anak garuda clairine clay saran joshua suherman maklum joshua	2
5	verdi solaiman produseri film anak garuda	2
5	syuting film anak garuda negara eropa reaksi rebecca klopper via	2
5	mbois cokelat shooting video klip soundtrack film anak garuda garapan spi	2
5	mbois cokelat shooting video klip soundtrack film anak garuda garapan spi	2
5	launching film anak garuda	2
5	verdi solaiman butterfly pictures garap film anak garuda	2
5	kemarin cast anak garuda tunggu kehadiran cast anak garuda dikota kota lupa nonton film anak garuda bioskop bioskop kesayangan	2
5	film anak garuda	2
5	rilis film anak garuda diperkuat soundtrack band cokelat	2
5	anak garuda faozan rizal butterfly pictures coming soon teaser official film anak garuda dibintangi tissa biyan violla georgie ajil ditto clairine clay	2
5	anak garuda faozan rizal butterfly pictures coming soon film anak garuda dibintangi tissa biyan violla georgie	2
5	sekolah selamat pagi dipromosikan film anak garuda	2
5	hey guys dont miss it januari film anak garuda tayang bioskop indonesia tiket gratis contact dmwa anak garuda harus	2
5	alo loop station suroboyo mengulang memori waktu spesial appearance promo film anak garuda indonesia kolaborasi telkomsel	2
5	erzaldi ajak anak yatim nonton film anak garuda	2
5	film anak garuda harus tayang bioskop januari nonton duluan kamis desember mega bekasi xxi jam wib pesan tiket	2
5	trailer terbaru film anak garuda hadir website idfilmcenter tonton trailernya link	2
5	valuable encouragement for valuable environment lupa nonton film anak garuda tanggal januari anak garuda harus faozanrizal fraulein	2
5	angga oliv anak garuda jambi datangnya cinta turun hati anak garuda anakanak spi yuk ikuti nonton premier film anak garuda bioskop	2
5	haloo anak garuda jam official trailer film anak garuda rilis sosial media butterfly pictures so stay tuned guys faozanrizal fraulein vidasylvia	2
5	guys cetak gantungan kunci pin custom ajah harga murah meriah lhoo tuh banyak bikin terima kasih film anak garuda kab madiun qty pcs cetakpin ganci model	2
5	the best version of yourself lupa nonton film anak garuda tanggal januari anak garuda harus	2
5	niat lupa nonton film anak garuda tanggal januari anak garuda harus	2
5	abid nntn premiere film anak garuda mostly nntn china baru minoritas yaaaaa nggakpapa wkwkwk	2
5	jumat kemarin ketemu pemaintokoh asli film anak garuda besok minggu januari jam menyapa nonton central city xxi so buruan beli	2
5	film anak garuda dinikmati bareng temanteman keluarga bioskop yukkk tunggu tunggu review	2
5	film anak garuda dinikmati bareng temanteman keluarga bioskop yuk simak merekamereka nonton	2
5	film anak garuda dinikmati bareng temanteman keluarga bioskop yuk simak merekamereka nonton	2
5	sabtu film anak garuda bioskop setiabudi semarang	2
5	film anak garuda sabtu bioskop city dp	2
5	live tonton visit media anak garuda cast karakter asli film anak garuda ig fb penasaran gimana keseruannya sostay tune	2
5	film anak garuda diangkat kisah tujuh alumni sekolah selamat pagi indonesia	2
5	saksikan all about film anak garuda kick andy januari metro tv	2
5	new post dilla rebecca pemain film anak garuda hadir balikpapan terbatkan semangat generasi muda	2
5	film anak garuda jumat bioskop city dp setiabudi berkurang	2
5	episode kedatangan pemain film anak garuda tissa biani rebecca klopper ajil ditto menceritakan keseruan seputar film anak garuda muthix saksikan malam jumat wib metro tv	2
5	news video kunjungan kru pemeran film anak garuda tribun kaltim	2
5	ajil dito memerankan robet film anak garuda gampanggampang susah mudahnya memerankan robet ceria kadang konyol sifatnya aksen jawa timuran robet kental tantangan tersendiri jumat januari pkl wib	2
5	film anak garuda tayang bioskopbioskop yuk simak merekamereka nonton swipe kanan bioskop terdekat	2
5	rabu film anak garuda bioskop central city semarang	2
5	selasa feb film anak garuda tayang bioskop central city	2
5	review film anak garuda	2
5	kamis film anak garuda	2
5	tayang film anak garuda rabu bioskop citra jam	2
5	potret clairine christabel pemeran olfa film anak garuda	2
5	sabtu film anak garuda bioskop dp mall semarang	2
5	tayang film anak garuda dp mall	2
5	kampoeng kidz transformer center lokasi syuting film anak garuda	2
5	kamis film anak garuda bioskop dp mall semarang film bertahan minggu bioskop semarang	2
5	film anak garuda rabu bioskop dp	2
5	film anak garuda selasa bioskop dp	2
5	film anak garuda senin bioskop dp	2
5	md wts voucher tiket film anak garuda xxi cinema hb rb tiket seharga rb hj rb cod stasiun tangselmanggarai shopee minat dm	2
5	film anak garuda minggu bioskop dp	2
5	terimakasih meluangkan waktu menonton film anak garuda kesempatan nonton transmart jam	2
5	film anak garuda sabtu bioskop dp berubah	2
5	film anak garuda jumat bioskop dp	2
5	menjual kaos anak garuda harus film anak garuda the movie seharga rp dapatkan produk shopee	2
5	lokasi chatime kegiatan revisi cv bikin resume diselingi mendengar tante ngomelin paguyubannya gamau diajakin nonton film anak garuda	2
5	film anak garuda kamis bioskop dp	2
5	bang nonton film anak garuda rating	2
5	jadwal film anak garuda bioskop indonesia	2
5	film anak garuda rabu bioskop dp	2
5	terima kasih mendukung menonton film anak garuda sharing film anak garuda	2
5	terima kasih sahabat anak garuda indonesia menonton film anak garuda anak garuda tayang bioskop	2
5	anak garuda terbang tinggi menatap matahari saksikan film anak garuda dibioskop kesayangan	2
5	terima indonesia saksikan film anak garuda dibioskop kesayangan	2
5	eiffelyes did it guyspengen tau gimana perasaan olfa menginjakkan kaki kota impiannya paris menara eiffel saksikan film anak garuda dibioskop kesayangan	2
5	live learn love tau exictednya wayan eropa berkunjung impiannya tepatnya sungai siene paris saksikan film anak garuda dibioskop kesayangan	2
5	with god all things are possible guys tau gimana sih excitednya dilla merasakan salju saksikan film anak garuda dibioskop kesayangan	2
5	nothing is impossible gimana perasaan robet berhasil mewujudkan impiannya menginjakkan kakinya place de la concorde paris saksikan film anak garuda dibioskop kesayangan	2
5	mouline de rouge harus guys tau gimana perasaan sheren menginjakkan kaki paris tepatnya mouline de rouge saksikan film anak garuda dibioskop kesayangan	2
5	indahnya arc de triomphe paris kesempatan dilupakan say hasil mengkhianati proses saksikan film anak garuda dibioskop kesayangan	2
5	basilika sacr cur berdosa lakukan guys sih gimana perasaan yohana menginjakkan kaki basilika sacr cur paris saksikan film anak garuda dibioskop kesayangan	2
5	shooting batu film anak garuda eropa yuk intipin keseruannya lupa nonton film anak garuda bioskop	2
5	yuk intipin keseruan dibalik pembuatan film anak garuda nih official video behind the scene film anak garuda yuk cek youtube butterfly pictures tap link on bio bioskop	2
5	press conference surabaya dihadiri produser verdi solaiman penasaran kota kunjungi stay tune instagram yah update info seputar film anak garuda	2
5	press conference film anak garuda diadain surabaya penasaran kota kunjungi stay tune instagram yah update info seputar film anak garuda	2
5	surabaya suara surabaya radio fm tunggu kehadiran cast anak garuda kota kota lupa nonton film anak garuda bioskop bioskop kesayangan	2
5	surabaya she radio tunggu kehadiran cast anak garuda kota kota lupa nonton film anak garuda bioskop bioskop kesayangan	2
5	cast anak garuda tunggu kehadiran cast anak garuda dikota kota lupa nonton film anak garuda bioskop bioskop kesayangan	2
5	jenny zhang aktris berdarah tionghoa berperan ce yenny istri ko jul film lupa nonton film anak garuda bioskop bioskop kesayangan	2
5	aldy rialdy aktor berkebangsaan indonesia berperan rully film anak garuda peran rully terkedjoed bioskop so stay tune sob	2
5	keseruan cast film anak garuda press conference tanggal agustus dibioskop anak garuda the movie bioskop kesayangan	2
5	keseruan cast film anak garuda press conference tanggal agustus coming soon	2
5	sheren si gadis pemberani madiun kehilangan ayahnya duduk kelas sd kecelakaan menjempu sheren sekolah saksikan film anak garuda dibioskop	2
5	anak wayan harus bertanggung ditengah kondisi tuanya yan bercerai kondisi ekonomi saksikan film anak garuda dibioskop	2
5	mengalami keminderan berasal keluarga kurang kondisi ayah penjual cilok robet melampiaskan perasaannya kenakalan saksikan film anak garuda bioskop	2
1	film imperfect tonton dah seru tau	1
1	nonton film imperfect bagus banget kayaknya	1
1	nonton film imperfect bagus banget kayaknya	1
1	film imperfect dah keren cui pgn nonton relate banget gue	1
1	film imperfect sebagus salut karakter peran dika rara	1
1	gila keren banget film imperfect perfect	1
1	akhirnya nonton milly mamet movie hooqduh sebagus lucu banget suka banget drama kehidupannya ahhhhh sabar nunggu film imperfect nyapasti film nyentil banget	1
1	film imperfect keren banget film indonesia bagus bagus euy terimakasih tina ditraktir nonton semoga rejekinya banyak nraktir nonton oiya lupa tina main twitter gpapa dah	1
1	tonton film imperfect deh bagus	1
1	tonton film imperfect deh bagus	1
1	imperfect ernest prakasa bersyukur akhirnya nonton imperfect menjelang turun layar predikat film terlaris indonesia tahun film imperfect acting cast bagus supporting cast menang mencuri perhatian	1
1	nonton film imperfect bagus banget kayaknya	1
1	nonton film imperfect bagus banget kayaknya	1
1	baru nonton berhasil mengangkat menyenangkan banyak harus nonton film sih pesannya bagus tim	1
1	baru nonton berhasil mengangkat menyenangkan banyak harus nonton film sih pesannya bagus tim	1
1	imperfect sebagus kirain cuman film sebatas body shaming insecure	1
1	film imperfect sebagus salut karakter peran dika rara	1
1	imperfect arah body shamming nkcthi arah mental film bagus banget	1
1	tall girl kek imperfect sih bagus nih film cem gini foto pesan moral ditarik film tsb	1
1	akhirnya nonton milly mamet movie hooqduh sebagus lucu banget suka banget drama kehidupannya ahhhhh sabar nunggu film imperfect nyapasti film nyentil banget	1
1	bagus banget astagaaa film mewek sungguh baper hati abis dibikin nangis eh dibikin ketawa deh koh	1
1	bagus banget astagaaa film mewek sungguh baper hati abis dibikin nangis eh dibikin ketawa deh koh	1
1	trending nih film imperfect sebagus	1
1	film imperfect keren banget film indonesia bagus bagus euy terimakasih tina ditraktir nonton semoga rejekinya banyak nraktir nonton oiya lupa tina main twitter gpapa dah	1
1	imperfect bagus banget studio penuh film tayang lumayan lamaaa kocak abis ngerti koh bikin film ngena segala aspek sih cinta keluarga karir komedi bikin film koh banyak	1
1	tonton film imperfect deh bagus	1
1	film tonton bagus hehehe tergantung suka genre hehehe ntn imperfect ipman mnrt ku nilai hehehe ntn drama korea deh judul revolutionary love perfect banget mnrt hehe	1
1	imperfect bagus banget studio penuh film tayang lumayan lamaaa kocak abis ngerti koh bikin film ngena segala aspek sih cinta keluarga karir komedi bikin film koh banyak	1
1	tonton film imperfect deh bagus	1
1	film tonton bagus hehehe tergantung suka genre hehehe ntn imperfect ipman mnrt ku nilai hehehe ntn drama korea deh judul revolutionary love perfect banget mnrt hehe	1
1	keren film menyadarkan bersyukur sadar potensi miliki	1
1	seneng banget sih tontonan realita	1
1	lucu banget sedihnya pokonya keren bikin hati campur aduk nontonnya	1
1	bangga banget ernes bikin film sekeren	1
1	jessica mila totalitas banget sih hebat rela gendutin badan film keren filmnya	1
1	terkejut sebagus filmnya bikin nangis	1
1	film nilai bagus mengajarkan orangorang bersyukur atas pemberian tuhan	1
1	aaahhhh filmnya keren reza rahardian	1
1	lucu seru banget humornya mantap filmnya	1
1	film terbaik sih menurutku bermanfaat nilai moralnya banyak	1
1	uuhh menangis keren banget actingnya reza	1
1	film menghibur utuh pesan kaya apik	1
1	campur aduk ditambah humor anakanak kos	1
1	keren film relate kehidupan	1
1	apresiasi banget atas suksesnya film keren	1
1	keren lurr	1
1	film memaparkan realita body shaming	1
1	gokil	1
1	pemainnya totalitas banget	1
1	harus nonton	1
1	bangus banget	1
1	nonton keren	1
2	film nkcthi bagus	1
2	suka memodifikasi karya karya bagus filkop keluarga cemara semoga visinema benarbenar film nkcthi cerita brilian setau buku ignya berisi kutipan	1
2	film nkcthi bagiku film benar rapi keren	1
2	film nkcthi ceritanya bagus dekat kehidupan seharihari sadar pas nonton tibatiba air netes gitu	1
2	film drama keluarga terbaik susah banget nahan nangis keluarga bagus relate banget anak adik perempuan angkasa karya mas mba terbaik	1
2	film drama keluarga terbaik susah banget nahan nangis keluarga bagus relate banget anak adik perempuan angkasa karya mas mba terbaik	1
2	film nkcthi bagus	1
2	bagus banget film nkcthi relate banget keluarga cerita film bikin hati hangat	1
2	nonton nkcthi benerbener film indo alurnya bagus susah tebak sukaaa banget parahh	1
2	film nkcthi ceritanya bagus dekat kehidupan seharihari sadar pas nonton tibatiba air netes gitu	1
2	pulang pulang bengeppp merahh ni mataa suara bindeng woii sebagus filmnyaaaa huuuh fak boii banget gila sii keren ahahah monang dehh	1
2	mencolok nkcthi the series blocking framing keren parah malih pingin nggawe film	1
2	woy ah gila scene keren ditambah backsong bikin ambyar	1
2	keren ditunggu tayangnya	1
2	memiliki ekspetasi film nkcthi pas nonton nangis film ahaha iya alay bagiku film benar rapi keren	1
2	pulang pulang bengeppp merahh ni mataa suara bindeng woii sebagus filmnyaaaa huuuh fak boii banget gila sii keren ahahah monang dehh	1
2	film nkcthi sebagus	1
2	baru nonton keren banget jam agak bingung	1
2	baru selesai nonton nkcthi keren banget film kayaknya begadang nih antrian film	1
2	menarik nih love for sale prekuel nkcthi film	1
2	terharu banget nonton nkcthi alur ceritanya keren	1
2	nangis film nkcthi bagus	1
2	filmnya menguras emosi air menyentuh banget	1
2	pemainnya hebat sih meranin baik pesan ceritanya ngena banget	1
2	keren banget layak ditonton menguras emosi	1
2	harus banget nonton film nkcthi	1
2	film nkcti ngingetin keluarga keren	1
2	film nkcthi dikemas visual indah settingnya oke	1
2	actingnya rachel amanda awan bagus banget penjiwaannya keren	1
2	emosional banget harus ditonton guys	1
2	film sangatsangat terarah detil	1
2	sedih nonton bagus wajib ditonton	1
2	bagus	1
2	menguras emosi air tanks nkcthi	1
2	wowww keren banget film nkcthi bikin penonton nangis	1
2	mantap wajib nonton	1
2	nonton sebagus	1
2	banyak nilai moralnya mantap	1
2	harus nonton	1
2	film nkcthi film terbaik mas angga sasongko sejauh	1
2	nkcthi can relate	1
2	angga sasongko sutradara penulis skenario menyuguhkan realitas dialami segala jenis keluarga beban anak sulung anak tengah diabaikan si bungsu pilihan penuh diam ayah segala film dekat	1
2	kejutan penampilan ardhito pramono berhasil nyawa karakter kale film nkcthi	1
2	salah elemen patut diapresiasi pemilihan lagu film	1
2	lagu soundtrack film nkcthi berhasil menambah adeganadegan filmnya istimewa	1
2	trio kakakberadik rio dewanto sheila dara rachel amanda sanggup menarik simpati penonton chemistry	1
2	lupa nonton film nkcthi	1
2	soundtrack film nkcthi keren banget	1
2	penyanyi ardhito pranomo akting bagus adegan berpurapura	1
3	banyak rapper ngisi soundtrack film gundala keren filmnya karya joko anwar joko	1
3	film gundala cameonya hasmi keliatannya bagus biar kek avenger cameonya stan lee	1
3	salah menyambut menunggu gundala hopefully temantemannya universe beraksi layar lebar film gundala bagus here am welcoming with my regards	1
3	duh si film gundala keren banget sih	1
3	baru tau indonesia tuh mcu namanya bumilangit semenjak joko anwar rencanain bikin film gundala keren	1
3	salah keren film gundala scene ditake tau waktu syuting pakai studio they shoot on real locations	1
3	baru nemu film gundala sekian keren banget siih	1
3	film gundala keren banget gila	1
3	film gundala sempurna no kritik	1
3	film gundala keren banget gila menyesal nonton bioskop	1
3	film gundala keren banget gila menyesal nonton bioskop	1
3	suka film gundala asli karya anak bangsa	1
3	suka film gundala asli karya anak bangsa	1
3	gundala dora bumi langit film bagus ngajak	1
3	ku suka banget namanama film gundala tuhridwan bahriganda hamdandirga utamatanto ginanjardesti nikitaghani zulhamfadli azisito marbunenak gitu namanya bagusbagus	1
3	gundala konsepnya bagus banget yaallah sukaa suka dedek awang akhirnya film indo model kereeen banyak tutup paa adegan dedek keroyokan sabar nungguin film jagat sinema bumi langit	1
3	gundala konsepnya bagus banget yaallah sukaa suka dedek awang akhirnya film indo model kereeen banyak tutup paa adegan dedek keroyokan sabar nungguin film jagat sinema bumi langit	1
3	mongasih tau color grading gundala bagus banget gua pribadi feel ceritanya kurang ngena jelek film barat asli deh salfok cinematicnya keren parahsemoga perfilman indonesia maju	1
3	malam well spent bangetpulang nyempatin nonton gundalakeren banget sih ukuran film hero terbaru film film hero bagus meningkat	1
3	mba nonton film gundala nontonlah bagus film	1
3	kemarin banyak film bagus satupun gundala	1
3	film hero pembuka bcu aka bumilangit cinematic universe gundala bagus akting cginya	1
3	gundala film hero film indonesia clapswoe film menarik banget jalan cerita heronya adegan efek dllnya bagus banget	1
3	overall film bagus jelek menarik ditontonkalo membandingkan gundala perempuan tanah jahanam gue pilih perempuan tanah jahanam	1
3	gundala sebulan wkwkwk reviewnya bagus bertahan sebulan heran film lorong trailer seru pas nontn uda turun panggung baru minggu	1
3	sejauh film indonesia bagus menurutku cek toko sebelah gundala putra petir	1
3	film lo bagus ko bangjujur antusias banget pas lu nge up gundala heros jagat bumilangit makasih banyak bang gue suka banget film gendre superhero	1
3	sejauh film indonesia bagus menurutku cek toko sebelah gundala putra petir	1
3	menikmati film baik efek visualnya tergolong bagus	1
3	bagus filmya	1
3	keren gilsss	1
3	film gundala penuh aksi menegangkan keren	1
3	nilai plusnya efek visualgundalatergolong bagus film indonesia adegan polesan nyaman mengganggu	1
3	film ditopang akting bagus pemain utama bront palarae merebut perhatian penonton abimana	1
3	gundalasebagaipilot projectjagat sinema bumilangit gerbang penasaran bagaimanaplot holeplot holeakan dikembangkan mengapungkan harapan film keduagundalaakan baik	1
3	suka humornya lumayan kakukaku lucu hehehe	1
3	pikir sih film gundala lumayan kekurangan harapan sekuel jauh baik tunggu yaaaaa selamat film indonesia	1
3	bagus film gundala lumayan standart film avanger indonesia	1
3	gundala menampilkan visualisasi memuaskan	1
3	hebat katarnya bagus penuh aksi	1
3	film gundala harus ditonton guys	1
3	keren aksi aktornya film gundala	1
3	mantap wajib nonton film gundala	1
3	harus nonton film gundala	1
3	nonton suka	1
3	nonton film gundala doi hehe	1
3	sebagus latar tempatnya berasa cerita gundala	1
3	mantap film superhiro indonesia menakjubkan	1
3	banyak adegan lucu si film gundala menghibur	1
4	nonton film garis biru suaranyaaaa gimana guys bagus	1
4	angga aldi yunanda pemain film garis biru harus filmnya bagus	1
4	ambil contoh film garis biru filmnya bagus	1
4	iyahh gemes film garis biru actingnya bagus	1
4	selesai nonton film garis biru congaratulations for the movie so proud of you guys bagus banget filmnya recommended banget menghibur	1
4	film garis biru doi keren banget wkwk	1
4	gila parah si nonton film garis biru iflix basah nih bantal buntet nih idung membius nangis film merem ngimpi gua nangis gajelas gara gara film keren banget filmnya	1
4	baru nonton film garis biru iflix filmnya keren banget	1
4	garis biru bagus dikemas detil script take pemainnya wajar hype film garis biru tinggi nonton berulang bosan baper meresapi big applous to actingnya bagus banget	1
4	tau telat banget but film garis biru emang terbaik aslii	1
4	film garis biru bagus hehe maaf telat banget	1
4	bagus film garis biru	1
4	film garis biru jiplak film korea jenny juno hem disayangkan emang iya filmnya bagus	1
4	berhasil nonton film garis biru scene uks emang keren	1
4	bagusan film garis biru	1
4	film garis biru bagus	1
4	penasaran film garis biru kayaknya bagus sebagus film posesif	1
4	film garis biru keknya bagus coming soon	1
4	film garis biru bagus neh gatau tayanggg	1
4	garis biru film layak tonton wkwk	1
4	film garis biru bagus banget	1
4	kemarin ajak nonton garis biru lumayan bagus	1
4	contoh penulisan penyutradaraannya bagus garis biru kemarin mas selera sih film karya seni hubungannya penilaian	1
4	bagus gini film garis biru	1
4	jarang nonton film indo garis biru bagus	1
4	angga aldi yunanda pemain film garis biru harus filmnya bagus	1
4	angga aldi yunanda pemain film garis biru harus filmnya bagus	1
4	garis biru gua nonton sangking bagusnya emang film film dabest	1
4	ambil contoh film garis biru filmnya bagusngajarin seks diluar nikah enak pas eksekusi sisanya engga	1
4	baru nonton garis biru iflix bagus banget drama keluarga lengkap banget gatau nangis film	1
4	garis biru sebagus dikemas detil script take pemainnya	1
4	film garis biru sebagus hehe maaf telat banget	1
4	sebagus film garis biru	1
4	film garis biru sebagus hehe maaf telat banget	1
4	sebagus film garis biru	1
4	baru nonton garis biru iflix jujur film bagus banget sihhhh yaallah gue sedih nangis tersedu sedu nontonnya huwaaa	1
4	film garis biru bagus	1
4	nonton kayanya film garis biru bagus nih filmnya keren gitu penontonnya banyak nonton asuuuu inimah sinetron indosiar babi	1
4	bagus film garis biru	1
4	garis biru bagus banget fak	1
4	film garis biru bagus kayaknya	1
4	sinematografi dihadirkan film garis biru membantu penonton memaknai adegan contoh pengambilan gambar lokasi rumah dara cenderung mengandalkan close up kemewahan banyak detil pengambilan gambar rumah bima cenderung mencakup lanskap detail interaksi masyarakat kampung kota lengkap persoalanpersoalan	1
4	problema dihadapi tokoh serius warnawarna detail lembut film garis biru penonton harapan memperbaiki menghakimi kejadian	1
4	scoring musik film garis biru menyatu sederhana pemilihan soundtrack anak remaja membantu tersampaikannya pesan baik penonton	1
4	film garis biru ditonton melepaskan kacamata moralis konservatif upaya pencegahan bablasnya batas hubungan sehat penyadaran pendidikan seks komprehensif pemahaman seks hakikat perjalanan mengenal manusia	1
4	suka adeganadegan sepele manis khas gemesnya percintaan kayak harus nonton film garis biru	1
4	garis biru gina noer tertata rapi dibiarkan membisu penonton kesempatan menentukan pilihan lakukan terhanyut ceritanya	1
4	gue garis biru berhasil menampilkan problem detail sekaliguspilihanpilihansolusi memainkan perasaan logika penontonnya gue setujukarena contoh gue jauh halhal film inidekatdengan penonton	1
4	gue susah memutuskan film tergolonghappyatausad endingtapi orangorang yangbenar benarberada situasiitupatut bersyukurdan beruntungkarena memiliki keluarga suportif	1
4	gue bangga film garis biru inidapattayang bioskop indonesia apresiasi tertinggi	1
4	endingfilmini jenis happily ever after disukai publik ending terbaik diambil ending garis biru mengajarkan perempuan harus berhenti hancur memiliki bayi	1
4	garis biru harapan perempuanperempuan posisi dara melanjutkan hidupnya versi terbaik kesempatan kehancuran jalani	1
4	aktor berhasil memukau penonton akting gemilangnya reaksi diam memiliki pesan terselubung film film seakan membisu membiarkan penonton memaknai pesanpesan	1
4	wajib nonton film garis biru sih sex education	1
4	keren film garis biru berhasil ditayangkan indonesia	1
4	harus nonton berkali keren film garis biru	1
4	ceritanya unik lucu banyak pembelajaran	1
5	film anak garuda bagus ges harus nonton rilisnya bioskop ak suda nonton duluan heheh senang	1
5	film anak garuda tayang nasional xxi bandung menonton film dapetin banyak pelajaran ilmu hidup bagus anak remaja	1
5	film anak garuda keren si	1
5	film anak garuda bagus banget kemarin nonton pesan moral banyak ceritanya bagus bikin emosi turun gtuu	1
5	nonton film anak garuda film bagus menginspirasi kemarin tim jci east java mengunjunginya markas anak garuda sekolah selamat pagi indonesia	1
5	mari nonton film anak garuda insight sungguh berminat chat me	1
5	film anak garuda lumayan loh gaes menginspirasi menghibur tayang kepingin nonton buruan gelagatnya sih sebentar turun	1
5	bagus banget filmnya	1
5	film film terbaik tonton memotivasi agak lucu	1
5	keren bangetttt filmnyaaaa	1
5	pemilihan castingnyaa cocok banget sih menurutkuu kereeen	1
5	film keren tonton inii	1
5	keren banget sih eksekusinyaa terkejut film berdasarkan kisah nyataaa	1
5	salah film terbaik disutradarai kang faozan mantap semangat berkarya kang	1
5	film buatan indonesia gue film membosankan kayak film indo pas gue baru nonton sekolah santo yusup tropodo buagusss filmnya seru keren pokoknya best	1
5	keren filmnya diambil kisah bermotivasi nnton anak yatim biar anak yatim termotivasi dmna latarbelakangnya dipenuhi konflik film ambil hikmahnya bagaimna menggapai cita cita meraka penuh keterbelakangan hidup keras	1
5	akhirnya sumpah bagus banget	1
5	nonton bagus banget filmya	1
5	nobar lum puas sangking kerennya	1
5	uda nonton kemarin premiere snto yusup bagus banget gilak memotivasi banget ngakak banget sukses	1
5	filmnya bagus termotivasi btw nobar	1
5	bagus banget mengispirasi	1
5	nonton exclusive premierenya bali bagoooossssss	1
5	film keren rekomendasi banget beripikir cita terwujud harus tuhan ujian lewati pokoknya nyesal deh nontonnya	1
5	bagus banget filmnya	1
