3	ikutan sharing bikin superhero gitu anatomi berkembang chibi doang yaudah komedi larinya salah hero ku jauh film gundala nonton gundala bikin hero an	1
3	film gundala terkesan sosok pengkor mas	1
3	eru uda kerasa antusiasme komik lokal film gundala kemarin	1
3	tdi abis rs harapan bunda inget vaksin palsu balita tahun silam inget film gundala salah menginspirasi pesan moral film gundala	1
3	banyak indonesia terinspirasi bikin karakter superhero gara film gundala	1
3	semoga calling om joko anwar kutunggu aktingmu film gundala season	1
3	film gundala seru agk sihh	1
3	adademoorg hilangjadi inget film gundala	1
3	gundala film superhero asli indonesia tayang bioskop film film karya anak bangsagarapan sineas kondang indonesia joko anwar harus mengapresiasi film gundala menonton film	1
3	inget film gundala pas wakil rakyat habis dilantik pesta semacamnya tokoh pengkor kondisi negara rusuh	1
3	quote film gundala relate banget	1
3	qa tgl september kemarin kpi mendukung film gundala ditegur trailer film berdurasi mengandung bangsat	1
4	sukses film garis biru	1
4	sabar film garis biru mendingan koleksi merchandisenya filmya tayang keabisan loh filmnya super laaaaaaffff posted	1
4	nungguin film garis biru banget nih sampesampe gue tontonin tuh trailer berulang ayolah cepat screening	1
4	cgv denger lagu banda neira biru soundtrack film garis biru	1
4	film garis biru nonton bareng yuk deobi bandung gada temen	1
4	film garis biru bertujuan pendidikan seks remaja	1
4	thank you sobat multifandom ditunggu film garis biru	1
4	cantik film garis biru lucu	1
4	film garis biru film juno versi lokal	1
4	kak zara happy birthday semoga kak zara sukses sukses film garis biru nyaa all the best ka zara	1
4	btw sukses film garis biru nyaaa	1
4	selamat ulang tahun zarraaa melesat karirnya film garis biru sukses	1
4	bilang selamat prestasimu semoga oga film garis biru banyak penonton	1
4	film garis biru tayangnya cepat dah semoga sik benar yaaaa	1
4	sumpah sesedih gue nonton film garis biru	1
4	poster film garis biru ekspetasi ceritanya	1
4	harus takut film garis biru filmfilm indonesia banyak banget ngangkat tema berhubungan seks salah satunya akibat pergaulan bebas film akibat pergaulan bebas wow deh kayaknya ketimbang garis biru	1
4	zzzz kpn film garis biru tayang njing gasabarr menarikk	1
4	nonton film garis biru dilarang tayang penasaran	1
4	hmmmm film garis biru dijadiin referensi pacaran kebablasan wkwkkw	1
4	garis biru kode baru film garis biru	1
4	garis biru is lock semalam picture lock film garis biru hepi banget film semoga film diterima dinikmati tua	1
4	cantiknya masyaallah semoga sukses zara btw semoga film garis biru cepat rilis aamiin	1
4	fenomena sayang banget menurutku banyak blunder kayak film garis biru boikot tayang tuh filmnya petisinya up terusini mba mba bantuan kitabisa uang kuliahnya oxford ad temui hedonis	1
4	harapanku film garis biru ngasih pendidikan seksual terkait kehamilan remaja dibahas risikorisikonya remaja paham konsekuensi perilaku seks berisiko	1
4	ahiya film garis biru tayang deh	1
4	penasaran banget film garis biru fix	1
4	mostly orangorang bikin petisi kaya gitu berusaha menelaah jauh petisi kaya film garis biru ngelihat sekilas film sex bebas ngajarin gitu sex edu	1
4	demen bikin petisi petisian tuh hidup apasi heran kaya film garis biru kucumbu tubuh indahku kesel gua coba kasih opini gimana petisi tempatnya kaya gini beer	1
4	pemain film bumi manusia edukasi film garis biru sex bebas	1
4	ramai jakarta banyak pengamen kostum ondel ondel film garis biru kasih pengaruh	1
4	oke ngerasa jaman beda opened dianggap wajar like film garis biru contoh simpel	1
4	inget film garis biru	1
4	mbaknya nonton film garis biru dlu biar pandangan brtemu ortunya mantan smgt mbak	1
4	film garis biru berzina diluar nikah centang biru mundurrr gblk bngst sih lu sadar napa njingg	1
4	and then kangen nenek ummi malam susah tidur sengaja dekatnya kepalanya dielus tidur nenek bikin kangen dibawa nongkrong bareng iya nonton film garis biru nenek kurang romantis	1
4	film garis biru ditolak ramairamai jawabanya sederhana hakikat bangsa kecanduan moral mencari nonton menghakimi	1
4	inget film garis biru tua hamil pekerjaan seumur hidup mantap	1
4	pgn gue storyin potongan film garis biru	1
4	penasaran film garis biru eeey kemarin sempet nonton saking hecticnya	1
4	single fighter mendingan nungguin lanjutan film garis biru nungguin centang biru lanjutannya deh beneran	1
4	lagu film garis biru bikin mewek growing up rara sekar by daramuda	1
4	ramai film garis biru patut ditonton banyak hujatan	1
4	kasih tonton film garis biru	1
4	thanks god temenku goblok berantakan bilang film garis biru film layak tonton wkwk	1
4	chemistry pemeran film garis biru klop	1
4	gila banget scane film garis biru ibunya dara bima tatap tatapan bikin gue mewek	1
4	backsoundnya ngingetin film garis biru miripp	1
4	angga aldi yunanda pemain film garis biru harus filmnya bagus	1
4	film garis biru belajar	1
4	film garis biru tayang malaysia	1
4	ambil contoh film garis biru filmnya bagusngajarin seks diluar nikah enak pas eksekusi sisanya engga edukasinya banyak menganggap film mempromosikan seks diluar nikah miris	1
4	yeaybsk gala premiere film garis biruyg malaysia lupa datengbakal ketemu bimadara nih	1
4	salah kecewa film garis biru tayangnya pertamaa memuaskan mengedukasi gituu sutradaranya main gina noer kolab yandy laurens	1
4	film garis biru coming soon tahunan wkwkwk	1
4	dengar lagu waktu nonton film garis biru cukupkanlah ikatanmu relakanlah untukmu reflek lalukan waktu nangis terima kasih mas atas lagunya	1
4	baru inget film garis biru si puput main ukulele bawain lagunya jikalaunaif nyari chordnya dannnn gemes banget gas terosss	1
4	playlist ost film garis biru enak didengerin pagi	1
4	iya gue keinget film garis biru adegan uks njir nonton adegannya gemeteran gimana	1
4	gila gua bioskop nonton film garis biru ampe nonton wkwk	1
4	iyahh gemes film garis biru actingnya bagus	1
4	selesai nonton film garis biru congaratulations for the movie so proud of you guys bagus banget filmnya recommended banget menghibur	1
4	kak coba cari makna detail film garis biru filmnya worth it banget ceritanya simple relate jaman banyak maknanya	1
4	paaalinggg kesel case kayak gini ngerugiin bayi berdosa gatau apaapa milih lahir kutip kalimat suka film garis biru plisslaahh rahim tu manusia loh	1
4	setuju sih salah dialog film garis biru lakilaki baru ayah anak lahir perempuan hamil truuuuuue	1
4	film garis biru doi keren banget wkwk	1
4	inget salah scene film garis biru pas dara korea ibunya bima harus korea daranya bilang tante	1
4	gila parah si nonton film garis biru iflix basah nih bantal buntet nih idung membius nangis film merem ngimpi gua nangis gajelas gara gara film keren banget filmnya	1
4	baru sempet baca sinopsis film garis biru gambaran ceritanyaa semoga proses editing berjalan baik lancar nonton antusias film	1
4	romantis film garis biru berkali nonton kerasa nyentuhnya	1
4	penasaran film garis biru dalem ondelondel baik benar	1
4	nonton film garis biru	1
4	inget adegan film garis biru pas dara nangis bima ngomong enak nangis dijadiin senjata kirakira gitu sakit sakit	1
4	film garis biru sadar harus banyak belajar allah mental ku harus dipupuk	1
4	fix abis bikin lanjutan film garis biru season	1
4	gua nonton film garis biru ter inspirasi nyari suami terinpirasi mananya coba	1
4	baru nonton film garis biru review sosiolog kw nih reaksi abis nonton	1
4	nonton film garis biru anjeeng flashback	1
4	habis nonton film garis biru diambil pelajaran anak muda nakal harus canggih an nakal memikirkan resiko	1
4	nonton film garis biru nangis takut amitamit kayak gitu	1
4	menonton film garis biru menikah jauh sedih menakutkan idk	1
4	baru nonton film garis biru iflix filmnya keren banget	1
4	dibikin baper film garis biru	1
4	garis biru sebagus dikemas detil script take pemainnya wajar hype film garis biru tinggi nonton berulang bosan baper meresapi big applous to actingnya bagus banget	1
4	baru nyadar bima film garis biru ganteng	1
4	gimana dah film garis biru stuck in my head	1
4	tau telat banget but film garis biru emang terbaik aslii	1
4	film garis biru sebagus hehe maaf telat banget	1
4	sebagus film garis biru	1
4	keinget pas nonton film garis biru pas dara dijemput mama papanya pulang kerumah ikantanmu relakanlah untukmu auto ngalir air matanya	1
4	film garis biru jiplak film korea jenny juno hem disayangkan emang iya filmnya bagus	1
4	banyak pesan moral diambil dlm film garis biru	1
4	abis kelarin film garis biru sedalem	1
4	ni anak film garis biru nongol mulu eksplor instagram tau tau kesengsem	1
4	nder nonton film garis biru disitu penjelasannya	1
4	gabut akhirnya berminat nonton film garis biru tertarik gimana banyak spoiler beredar abis nonton	1
4	film garis biru seru sih cringe sih	1
4	berhasil nonton film garis biru scene uks emang keren	1
4	baru nonton film garis biru hahaha thank you iflix	1
4	bagusan film garis biru	1
4	rebahan nonton film garis biru wkwk baru nonton bikin baper gile moral value banget anak muda hikmah kejadian pilihan terbaik kesalahan	1
4	film gila kota film garis biru penghargaan ffi loh yuk cari pemenang	1
4	film garis biru mengajarkan orangtua mudah sekedar ngelahirin anak selesai tanggungjawabnya seumur hidup mental finansial gagal golongan kaum rebahan gampang ambyar	1
4	ngatain film garis biru ngajarin remaja berzina ngamilin anak boikot pelemnya well salah maap gihh	1
4	banyak banget pesan moral film garis biru gimana orangtua orangtua bayi remaja	1
4	penulis natasha asterin aditama kesamaan nama latar kehidupan karakter lain-lain unsur ketidak sengajaan karakter terinspirasi film garis biru young mom cont	1
4	nonton film garis biru semenjak lelah	1
4	gue telat banget kuakui film garis biru pas scene bima ngobrol emaknya pas masukin kue dus bikin ngerembes air	1
4	oke film garis biru ratingnya	1
4	film garis biru mengajarkan berfikir diluar ekspetasi baper	1
4	baru sempet film garis biru tuh film kayak ditarik puber zaman sekolah proses pendewasaan segala kebodohan keegoisan nafsu menggebu segala kenaifan difikir	1
4	film menampilkan permasalahan keluarga seharihari film garis biru intinya sih rumah tangga pernikahan aktor didalamnya ayah anak	1
4	nonton film garis biru terngiang ngiang dikepalaku pesan dikirimkan hidupku doang baru paham maknanya gimana baru tau relatenya kemana baru tau perasaan dangkalnya semana	1
4	eh film garis biru sex education	1
4	soundtrack film garis biru ngena banget rara sekar suaramu merdu lagumu masukin playlist lagu favoritku	1
4	baru nonton sepotong film garis biru iflix gua takut tegang gitu	1
4	nulis blog film nkcthi buka tulisan film garis biru minder kadang baca tulisan suka kagum sapa nulis bagus bagus pas dibaca ismi nih	1
4	film garis biru bagus	1
4	abis trailer film garis biru dejavu banget film korea sumpah ih banget judulnya jeni jeno jeni apaaa gtttt	1
4	teasernya ekspektasi tinggi film garis biru	1
4	baru nyadar judul film garis biru tespek	1
4	penasaran film garis biru kayaknya bagus sebagus film posesif	1
4	gua penasaran film garis biru jarang film sex education gua berharap orng orng ngerti sex education biar gampang dibego begoin	1
4	gemes banget abis baca young mom pgn nonton versi filmnya daaannn gasabar banget film garis biru	1
4	film garis biru keknya bagus coming soon	1
4	penasaran film garis biru karya sekilas ngelihat trailernya pemainnya cewe cakep	1
4	film garis biru keknya gusba	1
4	film garis biru bagus neh gatau tayanggg	1
4	nntn film garis biru temenku gasuka nih genre kek gitu yauda hm	1
5	lewatkan exclusive premier film anak garuda kota tiket dipesan via gotix	1
5	terimakasih ibnu sina spi walikota banjarmasin berkunjung sekolah selamat pagi indonesia mensupport film anak garuda	1
5	termotivasi lupa tonton film anak garuda super duper keren deh kisah sutradaranya keren habis kiki narendra tissa biani sutradaranya om faozan rizal garap habibie ainun	1
5	bangga acara parenting kemarin bangga founder sekolah gratis sekolah tinggi selamat pagi indonesia bangga panitia persiapan launching film anak garuda film	1
5	film anak garuda real story kisah anak yatim piatu raih kesuksesan	1
5	film anak garuda angkat kisah anak indonesia	1
5	yuk guys free tiket nonton premiere film anak garuda dijamin mantul	1
5	perbincangan radio idola sekolah selamat pagi indonesia latar film anak garuda kisah perjuangan generasi millenial	1
5	team wings group join exclusive premiere film anak garuda proud sister proud family sabar nonton juuugaaaaa	1
5	exclusive premiere film anak garuda meriah banget terima kasih atas support keantusiasan keluarga pt wings surya lupa nonton film anak garuda tanggal januari anak garuda harus	1
5	poster official film anak garuda film berangkat kisah siswa siswi sekolah selamat pagi indonesia	1
5	anak garuda goes to school kediri tepatnya negeri kediri tim anak garuda main sekolah bisikin kolom komentar yah lupa saksikan film anak garuda bioskop kesayangan	1
5	nyerah mimin ngasih tau tahun film anak garuda dah kepo nonton loh nobar ala roadshow kota desember merchandise gemesh yuk beli tiketnya	1
5	film anak garuda terinspirasi kisah peraih kick andy heroes	1
5	tissa biani temukan kehangatan syuting film anak garuda	1
5	film anak garuda kisah perjuangan generasi millennial	1
5	film anak garuda terinspirasi kisah peraih kick andyheroes	1
5	cantiknya tissa biani si pemeran sayidah film anak garuda	1
5	film anak garuda perjuangan mengubah nasib tengah kekurangan	1
5	film anak garuda adaptasi kisah perjuangan pelajar indonesia film	1
5	fakta film anak garuda kisah riil inspiratif anak kaum marjinal	1
5	film anak garuda mengungkap kisah spi	1
5	perjuangan generasi millenial film anak garuda	1
5	film anak garuda ceritakan perjuangan siswa sekolah spi	1
5	film anak garuda kisah perjuangan generasimilenial	1
5	film anak garuda suguhkan kisah perjuangan generasi millenial	1
5	film anak garuda memotong rantai kemiskinan	1
5	film anak garuda kisah perjuangan siswa hebat via	1
5	film anak garuda mengungkap kisah spi gaya hidup	1
5	fakta film anak garuda kisah riil inspiratif anak kaum marjinal via	1
5	film anak garuda menceritakan kisah perjuangan selamat pagi indonesia via	1
5	film anak garuda adaptasi kisah perjuangan pelajar indonesia via	1
5	film anak garuda angkat kisah perjuangan yatim piatu raih kesuksesan	1
5	film anak garuda angkat kisah perjuangan yatim piatu raih kesuksesan	1
5	just another day for us an achievement for others minggu cokelat band kerjaan shooting video klip soundtrack film anak garuda film bercerita pencapaian mimpi	1
5	film anak garuda kisah perjuangan generasimilenial	1
5	kak kemarin wktu misa malam natal salah gereja katholik malang intensi misa permohonan kelancaran penayangan film anak garuda sabar nih moga lancarr	1
5	bupati kukar nobar film anak garuda	1
5	film anak garuda bagus ges harus nonton rilisnya bioskop ak suda nonton duluan heheh senang	1
5	benar ngefans violla georgie pas main film anak garuda cakep banget akting	1
5	lupa film anak garuda sebentar tayang karya selamat pagi indonesia keren koh takjub disana tanah ha disulap anak anak berkarya	1
5	official poster film anak garuda tayang januari bioskop kisah yatim piatu hina tertawakan mengalami luka batin kepahitan hidup terpinggirkan pandang sebelah	1
5	ceritanya besok senin diundang premier film anak garuda film menceritakan kisah siswasiswi selamat pagi indonesia menggapai impiannya ceritanya inspiratif bagikan info sekolah	1
5	film anak garuda mimpi nanggung	1
5	film anak garuda inspirasi	1
5	nobar spesial banget ketemu alumni spihighschool ridwan salah tokoh film anak garuda wow seru banget dah filmnya	1
5	inspirasi transformasi meraih mimpi polres jember ajak kaum millenial nobar film anak garuda tribratanews polres jember menularkan maha karya inspirasi tranformasi meraih mimpi kaum millenial kepolisian	1
5	with makerepost menentukan dimasa lakukan masalalu lupa nonton film anak garuda tanggal januari	1
5	walikota hadiri exclusive premiere film anak garuda humas	1
5	walikota hadiri exclusive premiere film anak garuda	1
5	pemutaran perdana film anak garuda platinum artos magelang harus ayo nonton	1
5	mari nonton film anak garuda insight sungguh berminat chat me	1
5	film anak garuda recommend	1
5	film anak garuda tayang nasional xxi bandung menonton film dapetin banyak pelajaran ilmu hidup bagus anak remaja	1
5	film anak garuda keren si	1
5	sukses film anak garuda surabaya next ktemu jakarta	1
5	mari nonton film anak garuda terinspirasi	1
5	ttg film anak garuda nonton yukkk nonton ketinggalan film inspiratif tahun cussss bioskop tayang	1
5	nntn film anak garuda bangga entrrpriser hdi	1
5	seru banget guyss solopos fm berkesempatan berbincang cast karakter asli film anak garuda tissabiani kikinarend mohiqbalsulaiman	1
5	nobar film anak garuda bacawabup nuri karimatunnisa inspirasi anakyatim	1
5	film anak garuda benar inspiring bangetz mengharukan ampe ambyar gue nangis parah bikin senyum ampe ketawa banyak banget positive gue ambil film nonton	1
5	film anak garuda diangkat kisah penuh inspirasi motivasi	1
5	film anak garuda karya perdana anakanak sekolah selamat pagi indonesia	1
5	film anak garuda disaksikan bioskop kisah inspiratif siswa siswi sekolah yatim piatu selamatpagi indonesia spi sukses entrepreneur muda diangkat layar lebar	1
5	komentar artis aktor penyanyi menonton film anak garuda nonton yukkk nonton ketinggalan film inspiratif tahun cussss bioskop tayang	1
5	oke gus kayaknya menarik film anak garuda buatan anak negeri sepulang nonton pacar baru	1
5	kisah inspiratif siswa siswi yatim piatu sekolah selamat pagi indonesia spi diangkat layar lebar film anak garuda harus dibahas tuntas andy noya	1
5	film anak garuda banyak inspirasi sekolah	1
5	film anak garuda bagus banget kemarin nonton pesan moral banyak ceritanya bagus bikin emosi turun gtuu	1
5	waww mimpi yaallah direplay produser gaslah nonton film anak garuda gitu	1
5	eh bunda hahaha tgl feb banjarmasin nemani siswa don bosco nonton film anak garuda xxi duta mal ikutankah bun	1
5	anak kebebasan tanggung igi bali selenggarakan nonton bareng film anak garuda	1
5	nonton film anak garuda film bagus menginspirasi kemarin tim jci east java mengunjunginya markas anak garuda sekolah selamat pagi indonesia	1
5	komentarkomentar netizen menikmati film anak garuda menambah semangat yuk buruan nonton film anak garuda nonton film anak garuda tayang bioskop	1
5	oke ni film anak garuda you should really watch it guys	1
5	keseruan tim jcieastjava nobar semoga pesan film anak garuda hati menyerah bersyukur berani bermimpi menjaga	1
5	film anak garuda lumayan loh gaes menginspirasi menghibur tayang kepingin nonton buruan gelagatnya sih sebentar turun	1
5	kupang rnc tayang perdana film anak garuda karya rumah produksi butterfly pictures diminati pencinta film film mengangkat kisah proses kesuksesan tujuh alumnus sekolah selamat pagi spi kabupaten malang wali kota	1
5	difollback akun mvs baru ajaa well film anak garuda melebihi ekspektasi ku film bosan persahabatan remaja makna rate	1
5	film anak garuda cerita inspiratif seru kocak gambargambarnya memanjakan thanks to our talented director of photography amalia ts yukkk tunggu tunggu review	1
5	film anak garuda cerita inspiratif seru kocak gambargambarnya memanjakan thanks to our talented director of photography amalia ts yukkk tunggu tunggu review	1
5	yuk kenalin nih salah anak garuda banyuwangi dilla cewek fashionable jagonya urusan penampilan loh sob cewek kalem lembut kabarnya deket wayan loh hmm benar film anak garuda dilla diperankan rebecca klopper	1
5	fakta film anak garuda kisah riil inspiratif anak kaum marjinal via	1
5	film anak garuda film diangkat kisah perjalanan siswa siswi sekolah selamat pagi indonesia menggapai cita citanya rintangan hadapi menggapai cita cita saksikan film anak garuda bioskop	1
5	kemurahan tuhan butterfly pictures dipercaya presentasi film anak garuda hadapan menteri prof muhadjir effendy map menteri pendidikan kebudayaan acara simposium nasional penanaman nilai pancasila kota malang	1
5	kemurahan tuhan butterfly pictures presentasi film anak garuda menampilkan show anak garuda pesona sang garuda acara simposium nasional penanaman nilai pancasila kota malang	1
5	press conference film anak garuda tanggal agustus verdi solaiman produser film anak garuda loh nih sabar nungguin filmnya	1
5	niatnya baik tuhan jalan kalimat beliau menantang beliau mendirikan sekolah gratis selamat pagi indonesia saksikan film anak garuda dibioskop	1
1	ekspetasiku ketinggian filmnya	0
1	ceritanya monoton	0
1	membosankan jalan ceritanya	0
1	bosan endingnya ketebak	0
1	ceritanya membosankan banget ditebak endingnya	0
1	jelek filmnya menyesal nonton film imperfect	0
1	kurang greget sih endingnya kurang wow	0
1	norak menyesal sih nonton film	0
1	jalan ceritanya mudah ditebak kurang bagus	0
1	menarik alur ceritanya	0
1	menyesal deh berekspetasi tinggi film kecewa	0
1	filmnya	0
1	monoton banget endingnya	0
2	eh btw gue kayaknya berekspektasi film nkcthi hehehe	0
2	film nkcthi cringe	0
2	kurang suka film nkcthi	0
2	film samar loh	0
2	film nkcthi bikin sakit hati	0
2	menyesal nonton film nkcthi gatau gasuka filmnya	0
2	lebay filmnya telalu	0
2	actingnya norak	0
2	sih filmnya	0
2	kurang memuaskan	0
2	bosan deh alur cerita nkcthi	0
2	ceritanya muak	0
2	jelek monoton	0
2	samar banget film mah pemeranya duka	0
2		0
2	jujur nangis lantas menyebut film cerita nkcthi bagus sih menemukan halhal janggal film bergenre drama	0
2	bintang film kurang relate kehidupanku banyak ketidakpasan sih	0
3	kurang suka akhir akhir adegan fighting film gundala pertengahan menarik segi fightingnya pas menjelang akhir melawan anak anak fightingnya lemah kurang greget effect cgi kedepan ditingkatkan	0
3	film impetigore gundala jelek akun kyk wocmen cenayang ngerekomendasiin ntn coba bilang jujur emang film	0
3	whaha benar gundala jelek banget ekspektasi terbentuk film horornya baguuss box office indonesia	0
3	bagus gundala versi joko anwar cuman beda ekspektasi seleraku ajah gundala slama komik orinya perbandingan film terdahulunya entar kubikin video review pedas gundala joko anwar channel youtubeku	0
3	bagus gundala versi joko anwar cuman beda ekspektasi seleraku ajah gundala slama komik orinya perbandingan film terdahulunya entar kubikin video review pedas gundala joko anwar channel youtubeku	0
3	film super mahal gundala ditonton cuman juta penonton gagal box office harusnya atas juta juta filmnya bagus banget gitu ajah gundalanyakurang wow	0
3	film super mahal gundala ditonton cuman juta penonton gagal box office harusnya atas juta juta filmnya bagus banget gitu ajah gundalanyakurang wow	0
3	menyesal banget nonton film gundala beda ekspetasi	0
3	rating tahun atas film gundala	0
3	koreonya kasar banyak banyak belajar bikin film maaf	0
3	sayang cerita dieksekusi menarik aksiaksi gundala melawan kejahatan datar mengundang emosi	0
3	penonton kurang terangsang gundala benarbenar pahlawan patriot jagoan	0
3	narasi kurang ramah film rating tahun atas rasarasanya cerita sarat isu remaja berusia tahun menontongundalasebagai hiburan	0
3	bikin pusing memahami ceritagundalasecara utuh butuh berpikir menonton konsentrasi	0
3	kelemahan cerita bolong atauplot holedalam film berdurasi menit disengaja ceritagundalabisa berkembang seriseri jagat sinema bumilangit	0
3	logika cerita film gundala kurang rapi matang	0
3	ceritanya kurang rapi adegan menimbulkan salah satunya tibatiba kontakgundalaamat mudah ditemukan sosok baru ditemuinya	0
3	perpindahan adegan membingungkan melompat adegan berpindah perkumpulan anggota dpr sancaka berdiskusi wulan tara basro agung pritt timothy kondisi keamanan	0
3	pembentukan karakter film gundala agak dipaksakan barisan anak buah pengkor joko ambisius membentuk karakterkarakter	0
3	faktor membuatgundalalagilagi koreografi banyak gerakan baku hantam kaku dibuatbuat pemain menggerakkan anggota tubuh perlahan hafalan	0
3	sayang film kisah legenda terburuburu	0
3	berharap avenger indonesia daya kualitasnya jauh dibawah harapan masyarakat film indonesia	0
4	garis biru film layak tonton wkwk	0
4	film garis biru jelek dibikin petisi dianggap senonoh	0
4	sih banget dah gua abis nonton film garis biru tbtb perut gua ikutan mual mual sue jelek	0
4	nonton film garis biru baru menit merinding serem horor bangsat wakakakakak menyesal nontonnya	0
4	sungguh kecawa film garis biru spoiler dilan bertemu dara bima bertemu milea adam diam diam meniduri dilan	0
4	petisi film garis biru tabu ketakutan	0
4	mencontohkan baik film garis biru	0
4	adegannya layak pemerannya dibawah umur	0
4	menyesal banget nonton garis biru	0
4	no duka film garis biru	0
4	gue suka film garis biru	0
5	bersemangat idelis ngumpulin ditengah cerita berantem baikan happy ending alurnya kaya gitu lelah nonton film kaya gini	0
5	agak kecewa filmnya review jujur tema harusnya mengedukasi banyak diksi dani hilang tengah cerita scene eropa mendominasi	0
5	sory min pendapat min judul kurang singkron filmnya kurang greget	0
5	filmnya monoton bosan lamalama nontonnya	0
5	alur ceritanya membosankan	0
5	hmm agak kurang suka deh mengambil posisi eropa greget indonesia mengangkat budaya indonesiaa	0
5	lagilagi film formula gitu ajaa bosan euy	0
5	film berdasarkan kisah iya benar inspiratif pengeksekusian film berdasarkan kisah td kurang baik pembagian porsi cerita kurang baik karakter menonjol pelengkap	0
5	filmnya menurutkuuu	0
5	pfffttt membosankan	0
5	huffttt jelek menurutku ekspektasiku tinggi	0
5	boseenin ngantuk nontonnya	0
5	kurang suka film monoton	0
5	pendalaman karakter pemaiinnya kurang nihhh merataaa	0
5	kurang suka pemilihan latar film eropa	0
5	zzzzz bosenin alur ketebakk kebanyakan film	0
5	kecewa sih yaudah terlanjur nonton film anak garuda	0
5	filmnya cuman ajil nonton	0
5	bosenin jalan ceritanya hmmm	0
5	bosan bettt	0
5	pas nonton bikin ngantuk	0
5	gilsss bosan banget nonton film anak garuda ketebak ceritanya	0
5	kurang suka film anak garuda	0
5	berasa nonton sinetron bosan	0
5		0
5	kurang menarik sih gue	0
